CTA Digital iPod Video Skin Case Model IP-HVPI - Retail	$9.95	$5.58
MARWARE Sportsuit Convertible for iPod nano - Black Model 602956002536 - Retail	$8.95	$5.58
XEROX Yellow Toner Cartridge For Phaser 6120 Model 113R00694 - Retail	$149.99	$7.15
Apple 3rd Gen iPod nano Pink 8GB Model MB453LL/A - Retail	$194.99	$0.00
QuickVerse Mac Black Box Edition - Retail	$78.95	$0.00
Miglia Dialog Phone Model DLG-02 - Retail	$59.99	$5.58
Symantec Norton Internet Security 3.0 for MAC with 1 Year of Live Updates - Retail	$88.95	$0.00
PROSOFT Drive Genius for Mac OS X - Retail	$99.95	$0.00
CTA Digital iPod Car and Airplane Charger Model IP-CAC - Retail	$19.95	$5.58
MARWARE Silicone case for the 1st gen iPod shuffle, Orange Color Model 602956001980 - Retail	$2.99	$5.58
BELKIN TuneCast II Mobile FM Transmitter for iPod Model F8V3080-APL - Retail	$39.95	$5.58
SummitSoft Mac Fonts 2 - Retail	$24.95	$0.00
Speck iPod Touch ToughSkin Armor Case Model IT-BLK-TSA - Retail	$24.95	$5.58
I-O DATA PRIE TUNETAG sienna for nano Model PRIE-TAG-05NA - Retail	$19.99	$5.58
Microsoft Office Mac 2008 Upgrade DVD - Retail	$204.95	$0.00
BOSE&#174; Portable rechargeable lithium-ion battery Model Sound Dock&#174; Battery White - Retail	$89.00	$0.00
DLO Hard-Shell Case with Built-In Kickstand for iPod classic Model 009-1001 - Retail	$19.95	$6.58
BELKIN TuneCast 3 FM Transmitter Model F8M010 - Retail	$49.95	$5.58
SCOSCHE Nano RF Remote control with Built in FM transmitter Model NRFM - Retail	$66.95	$5.58
Battery-Biz Extended battery pack for iPod Nano Gen 1 Model 609525505610 - Retail	$49.99	$5.58
CTA Digital iPod Video Skin Case Model IP-HVPI - Retail	$9.95	$5.58
MARWARE Sportsuit Convertible for iPod nano - Black Model 602956002536 - Retail	$8.95	$5.58
XEROX Yellow Toner Cartridge For Phaser 6120 Model 113R00694 - Retail	$149.99	$7.15
Apple 3rd Gen iPod nano Pink 8GB Model MB453LL/A - Retail	$194.99	$0.00
QuickVerse Mac Black Box Edition - Retail	$78.95	$0.00
Miglia Dialog Phone Model DLG-02 - Retail	$59.99	$5.58
Symantec Norton Internet Security 3.0 for MAC with 1 Year of Live Updates - Retail	$88.95	$0.00
PROSOFT Drive Genius for Mac OS X - Retail	$99.95	$0.00
CTA Digital iPod Car and Airplane Charger Model IP-CAC - Retail	$19.95	$5.58
MARWARE Silicone case for the 1st gen iPod shuffle, Orange Color Model 602956001980 - Retail	$2.99	$5.58
BELKIN TuneCast II Mobile FM Transmitter for iPod Model F8V3080-APL - Retail	$39.95	$5.58
SummitSoft Mac Fonts 2 - Retail	$24.95	$0.00
Speck iPod Touch ToughSkin Armor Case Model IT-BLK-TSA - Retail	$24.95	$5.58
I-O DATA PRIE TUNETAG sienna for nano Model PRIE-TAG-05NA - Retail	$19.99	$5.58
Microsoft Office Mac 2008 Upgrade DVD - Retail	$204.95	$0.00
BOSE&#174; Portable rechargeable lithium-ion battery Model Sound Dock&#174; Battery White - Retail	$89.00	$0.00
DLO Hard-Shell Case with Built-In Kickstand for iPod classic Model 009-1001 - Retail	$19.95	$6.58
BELKIN TuneCast 3 FM Transmitter Model F8M010 - Retail	$49.95	$5.58
SCOSCHE Nano RF Remote control with Built in FM transmitter Model NRFM - Retail	$66.95	$5.58
Battery-Biz Extended battery pack for iPod Nano Gen 1 Model 609525505610 - Retail	$49.99	$5.58
BELKIN iPOD Nano 2G Pink Silicon Case with Acrylic Top Model F8Z155-PNK - Retail	$19.95	$5.58
Speck iPod Classic ToughSkin Case with Belt Clip Model IC-CLR-TS - Retail	$26.95	$0.00
CTA Digital iPod Travelmate Speaker Model IP-PSW - Retail	$14.99	$5.58
macally Automobile Full Channel FM Transmitter &amp; Charger for iPod Model FMCUPB - Retail	$49.99	$5.58
BELKIN Voice Recorder for iPod Model F8E462 - Retail	$534.95	$5.58
DLO Shell for 3rd Generation iPod nano-clear Model 008-8000 - Retail	$16.95	$6.58
XtremeMac Crystal Clear Protection for iPod touch Model IPT-MSB-00 - Retail	$14.95	$5.58
PNY 2GB DDR2 667 (PC2 5300) Memory for Apple Laptop - Retail	$59.99	$5.58
I-O DATA Leather Case Black w/ Hook Model PRIE-AMB-02NA - Retail	$39.99	$5.58
Targus Slide Case for iPod mini Model AEB01US - Retail	$19.99	$5.58
I-O DATA Carrying Wallet Red Model PRIE-TWAL-01NA - Retail	$29.99	$5.58
rocstor ROCPRO 300C 500GB 7200 RPM 3.5&quot; USB 2.0 / IEEE 1394a / IEEE 1394b / eSATA External Hard Drive Model G228K6-S1 - Retail	$183.99	$0.00
VANGUARD Tamil 4 Black Case  for iPod nano Model Tamil 4/black - Retail	$9.95	$5.58
Adobe Premiere Pro CS3 For Mac - Retail	$789.95	$0.00
Adobe InDesign CS3 For Mac Upgrade - Retail	$195.95	$0.00
maxell Headphone Splitter Model 191206 - Retail	$9.99	$5.58
BELKIN Mobile Cassette Adapter for iPod Model F8V366-APL - Retail	$19.95	$5.58
Cygnett GrooveSnooze docking alarm clock &amp; radio for iPod Model CY-A-GZB - Retail	$69.95	$9.62
i.Sound Plasma white Speaker System and electromagnetic light show for iPod Model DGIPOD-362 - Retail	$69.95	$9.62
macally Stereo speakers and charger for iPod devices Model ICETUNE - Retail	$39.95	$5.58
V-MODA Vibe Red Roxx Earphones Model VM-V-REDROXX - Retail	$89.95	$5.58
BELKIN Blue Sport Armband Plus for iPod classic Model F8Z201-MBL - Retail	$29.95	$5.58
GRIFFIN Ultimate Black Sport Armband For iPod nano 3G Model Streamline - Retail	$24.95	$0.00
CORSAIR 3GB (2GB + 1GB) DDR2 667 (PC2 5300) Memory for Apple Notebook - Retail	$87.99	$5.58
SENNHEISER High-Quality Stereo Clip-On Earphone for iPod Model OMX90 VC Style - Retail	$69.95	$0.00
SoNNeT FM Transmitter + Dock + Car Charger for iPod Nano Model FMT-IPOD-NANO - Retail	$29.95	$5.58
LACIE Rugged ALL-Terrain 120GB 5400 RPM 2.5&quot; USB 2.0 External Hard Drive Model 301009 - Retail	$94.99	$0.00
DLO HomeDock Deluxe (2nd Generation) Model 009-9800 - Retail	$115.95	$6.58
XtremeMac Black/Gray Durable silicone case for iPod touch Model IPT-TWA-30 - Retail	$24.95	$5.58
i.Sound DuoPhones Headphone for iPod Nano Model DGIPOD-665 - Retail	$26.95	$6.58
I-O DATA Leather Case White w/ Hook Model PRIE-AMB-03NA - Retail	$39.99	$5.58
RhinoSkin iPod Nano Aluminum Hardcase Model 00614 - Retail	$19.99	$5.58
iLuv 2.1-Channel Mini Audio System For iPod Model i7500WHT - Retail	$129.95	$0.00
APPLE .Mac 5.0 Family Pack - Retail	$139.00	$0.00
BELKIN Clear Acrylic Case for iPod nano 2nd generation Silver Model F8Z141-SLV - Retail	$19.95	$5.58
EXTENSIS Suitcase Fusion - Retail	$99.95	$0.00
TRICOD iPod Video (A-Type) Silicon Case with screen protector.For 30GB Model CVR-IPODASILWH - Retail	$4.99	$5.58
Speck MacBook Pro 15&quot; See Thru-RED Model MB15-RED-SEE - Retail	$34.99	$6.58
iLuv High Fidelity Mini White Audio System Utilizing Bluetooth Technology Model i199WHT - Retail	$199.99	$8.10
rain iLap for 15&quot; MacBook Pro or PowerBook Model 10025 - Retail	$59.95	$7.48
DLO VoiceNote Voice Recorder for iPod Model 009-5797 - Retail	$29.95	$5.58
BELKIN Pink Leather Folio Case for iPod nano 3G Model F8Z206-RK - Retail	$24.95	$5.58
SimpleTech SimpleDrive 320GB 7200 RPM 3.5&quot; USB 2.0 / IEEE 1394a External Hard Drive (designed by Pininfarina) Model SP-UF35/320 - Retail	$139.99	$0.00
Cold War Games TopWare INTERACTIVE - Retail	$17.99	$5.58
BELKIN Folio Case for iPod nano, Pink Model F8Z058-PNK - Retail	$19.95	$5.58
BELKIN White Leather Folio for iPod classic Model F8Z207-OT - Retail	$29.95	$5.58
EREPLACEMENTS Battery For 1st &amp; 2nd iPod Model UP325385A4H - Retail	$29.99	$5.58
FREECOM Mobile drive PRO 160GB 5400 RPM 2.5&quot; USB 2.0 / IEEE 1394a External Hard Drive Model 29368 - Retail	$149.99	$6.58
EREPLACEMENTS iPod AC Adapter Model M8636LL-A - Retail	$19.99	$5.58
Cygnett Groove Ride FM Transmitter for iPod Model CY-3-FM - Retail	$34.95	$5.58
Apple Mac Pro MA356LL/A Intel Xeon 5150(2.66GHz) 1GB 250GB NVIDIA GeForce 7300GT Mac OS X v10.5 Leopard - Retail	$2,294.99	$33.63
rain iLap Laptop Stand 12&quot; Model 10022 - Retail	$29.99	$6.58
Rosewill White Case For iPod video 30G &amp; iPod Classic 80GB Model RSC-013 - Retail	$4.99	$0.00
GRIFFIN black Polycarbonate case with lights For Nano 1G/2G Model 8055-NDSKOB - Retail	$9.95	$0.00
VANGUARD Swing 54 Clear Case for iPod video 60GB Model Swing 54/clear - Retail	$4.95	$5.58
MARWARE SportGrip for iPod shuffle,  White Color Model 602956001928 - Retail	$3.99	$5.58
DLO HybridShell  for 3rd Gen iPod nano - clear front, white back Model 002-3437 - Retail	$16.95	$6.58
Speck Canvas Sport Case For iPod nano Model NN-PINK-CV - Retail	$26.95	$0.00
ultimate ears Mobile Earphones for APPLE Model Super.Fi 4vi - Retail	$149.99	$0.00
PROSOFT Data Backup 3 - Retail	$36.95	$0.00
Apple Mac mini MB138LL/A Intel Core 2 Duo 1.83GHz Dual  Core 1GB 80GB Intel GMA 950 Mac OS X v10.4 Tiger - Retail	$594.99	$9.08
BELKIN White Leather Folio Case for iPod nano 3G Model F8Z206-OT - Retail	$24.95	$5.58
Kingston 2GB (2 x 1GB) DDR2 667 (PC2 5300) ECC Fully Buffered Dual Channel Kit Memory for Apple Mac Pro - Retail	$112.99	$5.58
Klipsch Room Groove wireless iPod speaker system Model 1006602 - Retail	$299.95	$9.08
Max Payne Games MacSoft - Retail	$16.95	$5.58
VANGUARD iPod Carrying Case, White Model Swing 24/white - Retail	$29.95	$8.10
rocstor RocPort 4Cx 120GB 5400 RPM 2.5&quot; USB 2.0 / IEEE 1394a External Hard Drive Model B202E5-01 - Retail	$109.99	$0.00
CTA Digital Perfect Sound Noise Cancellation Headphones Model IP-HSC - Retail	$25.99	$5.58
iHome Speaker System with Dock for iPod-Black Model iH80B - Retail	$99.99	$7.48
iLuv Battery booster with silicone case for your iPod with video (60GB, 80GB) Model i604WHT - Retail	$54.99	$5.58
VANGUARD Tamil 6C Black Case  for iPod video Model Tamil 6C/black - Retail	$14.95	$0.00
Macally 3.5&quot; USB 2.0 Mac Enclosure Model ECO-350U-BB - Retail	$35.99	$0.00
Railroad Tycoon 3 Mac Games MacSoft - Retail	$18.95	$5.58
BELKIN Pink Silicone Sleeve for iPod nano 3G Model F8Z213-PNK - Retail	$19.95	$5.58
SoNNeT PodFreq mini for iPod mini Model FMT-IPOD-MINI - Retail	$19.99	$5.58
SCOSCHE iPod &amp; Nano RF Remote Car version Model IPNRFC - Retail	$69.99	$5.58
GRIFFIN Ultimate Silver Sport Armband For iPod nano 3G Model Streamline - Retail	$24.95	$0.00
THE OMNI GROUP Omnigraffle Pro 4.0 - Retail	$125.95	$0.00
GRIFFIN LCD / FM Transmitter for iPod Nano 2G Model 9690-NANOTRIP2 - Retail	$44.95	$0.00
Delapod Tan Backpack Style Purse iPod Model ip04camel - Retail	$52.59	$7.15
BELKIN White Classic Leather Case for iPod mini Model F8Z008 - Retail	$19.95	$5.58
BELKIN Clear Acrylic Case for iPod nano 2nd generation Green Model F8Z141-GRN - Retail	$19.95	$5.58
SCOSCHE 12v Car Charger for iPod w/ Cass Adapter Model IPCHRGPCA1 - Retail	$29.99	$5.58
CTA Digital 3 in 1 Car Kit Model IP-CAK - Retail	$29.99	$5.58
macally Portable Stereo Speakers for iPod nano 2nd Gen Model IP-N1112 - Retail	$24.99	$5.58
GRIFFIN PowerJolt SE Vehicle Charger for iPod &amp; iPhone Model 9776-PJLTSECLB - Retail	$16.95	$5.58
DLO Sport-Ready Neoprene Case for iPod classic Model 009-1428 - Retail	$16.99	$5.58
macally EcoMouse Model ECOMOUSE - Retail	$14.99	$7.15
iHome Portable Water-Resistant Speaker System for iPod Model iH20W - Retail	$74.95	$7.15
DLO HybridShell  for iPod Touch - Clear with Black Dots Model 002-3439 - Retail	$22.95	$6.58
KEYSPAN TuneView Remote Control For iPod Model TVI200C - Retail	$179.99	$6.58
VANGUARD Semnan 4 Black Case  for iPod nano Model Semnan 4/Black - Retail	$9.95	$5.58
Waawoo Technology Wow-Pen Traveler 2.4 GHz RF-Silver Model WP020-S - Retail	$69.95	$5.58
iRam 1GB DDR 333 (PC 2700) Memory For Apple Desktop - Retail	$49.99	$5.58
Macally 2.5&quot; USB 2.0 Mac Enclosure Model ECO-250U - Retail	$17.99	$0.00
GRIFFIN iClear Shell Case for 3rd Gen iPod nano Model 8156-NCLR - Retail	$14.95	$5.58
JENSEN Universal Docking Station w/ Speaker For iPod Model JiSS-120-BK - Retail	$36.95	$0.00
VANGUARD Semnan 6C Pink Case  for iPod video Model Semnan 6C/pink - Retail	$14.95	$0.00
XtremeMac 3 Pack Coordinated silicone case for iPod video 30GB Model IPV-TW3-13 - Retail	$24.95	$5.58
Symantec Norton Confidential for Macintosh - Retail	$45.95	$0.00
Adobe Dreamweaver CS3 For Mac - Retail	$393.95	$0.00
V-MODA Bass Freq iPod In-Ear Earphones Black Model VM-BF-BLACK - Retail	$39.95	$0.00
rain mStand laptop stand Model 10032 - Retail	$49.99	$7.48
Adobe Photoshop Elements 4.0 - Retail	$79.95	$0.00
rocstor RocPort 4U 120GB 5400 RPM 2.5&quot; USB 2.0 External Hard Drive Model B153E5-01 - Retail	$94.99	$0.00
Adobe Creative Suite 3 Web Premium for Mac - Retail	$1,559.95	$0.00
BELKIN Kickstand Case for 5G iPod Model F8Z068 - Retail	$24.95	$5.58
The Sims 2 University Game ASPYR - Retail	$32.95	$5.58
BELKIN White Headphone Splitter for iPod Model F8V234-GLD-APL - Retail	$7.95	$5.58
BELKIN Clear Remix Acrylic for iPod classic Model F8Z212 - Retail	$29.95	$5.58
Speck MacBook 13&quot; See Thru - GREEN Model MB13-GRN-SEE - Retail	$34.99	$5.58
BELKIN Black Leather Folio for iPod touch Model F8Z227-KR - Retail	$29.99	$6.58
SoNNeT Podfreq Premium FM Transmitter and Dock for iPod Model FMT-IPOD-PH - Retail	$89.99	$5.58
GRIFFIN Car Charger for iPod Model 9898-WPJOLT - Retail	$16.95	$5.58
iHome Personal Speaker System for iPod nano 1G &amp; 2G Model iHM1B2 - Retail	$24.95	$6.58
mushkin 4GB (2 x 2GB) DDR2 800 (PC2 6400) ECC Fully Buffered Dual Channel Kit Memory for Apple Server &amp; Mac Pro - Retail	$229.99	$0.00
DLO Leather Folio w/ Belt Clip for iPod classic Model 009-1000 - Retail	$16.99	$5.58
VANGUARD Swing 54 Blue Case for iPod video 60GB Model Swing 54/Blue - Retail	$4.95	$5.58
Rosewill Clear Case For iPod video 60GB &amp; iPod Classic 160GB Model RSC-018 - Retail	$4.99	$0.00
LACIE Rugged ALL-Terrain 200GB 7200 RPM 2.5&quot; USB 2.0 / IEEE 1394a / 1394b External Hard Drive Model 301310 - Retail	$354.99	$0.00
Kingston 256MB PC66 Memory for Apple Desktop - Retail	$50.49	$5.58
I-O DATA PRIE jewel nano fur Model PRIE-JWL-NA02 - Retail	$19.99	$5.58
CSDC Ovolab Phlink Macintosh - Retail	$119.95	$0.00
BELKIN 3.5mm Audio Cable for iPod Model F8V203-06-APL - Retail	$3.95	$5.58
LACIE 5&quot; IEEE 1394a d2 DVD&#177;RW with LightScribe Model 300979U - Retail	$118.99	$0.00
Apple MacBook MB062LL/B Intel Core 2 Duo 2.20GHz 13.3&quot; WXGA 1GB 120GB DVD&#177;R/RW Intel GMA X3100 - Retail	Price not available	$10.73
onOne software QX-Tools Pro 7 - Retail	$141.95	$0.00
Quark QuarkXpress 6.0 for Mac - Retail	$748.95	$0.00
SoNNeT USB Power Adapter For iPod Model IPOD-AC-CHG-B - Retail	$14.99	$6.58
GRIFFIN Dock Adapter for iPod shuffle 2G Model 9759-SHFADPTR - Retail	$16.95	$5.58
i.Sound Black Jeli Sleeve for iPod video 30Gb Model DGIPOD-962 - Retail	$11.95	$5.58
rocstor ROCPRO 800 AV 500GB 7200 RPM 3.5&quot; USB 2.0 / IEEE 1394a / 1394b External Hard Drive Model G212KA-01 - Retail	$185.99	$0.00
BELKIN Dual USB Power Adapter for iPod Model F8Z145 - Retail	$29.95	$5.58
XtremeMac Black Neoprene sport armband for iPod nano 1G &amp; 2G Model IPN-SPW-00A - Retail	$24.95	$5.58
BELKIN Carabiner Case for iPod nano, Black Model F8Z057 - Retail	$19.95	$5.58
MARWARE Silicone case for the 1st gen iPod shuffle, Pink Color Model 602956001935 - Retail	$2.99	$5.58
DLO Black Leather Folio w/ Belt Clip for iPod nano 3G Model 002-8000 - Retail	$16.99	$5.58
NYKO iTop Button Relocator for iPod Model 88025 - Retail	$9.99	$5.58
iLuv White Stereo Docking System Model i277WHT - Retail	Price not available	$7.48
Miglia micro speaker for iPod nano and shuffle Model HA05W - Retail	$24.99	$5.58
Rosewill White Case For iPod video 60GB &amp; iPod Classic 160GB Model RSC-020 - Retail	$4.99	$0.00
Kensington Car Mount for iPod and MP3 Players Model 33412 - Retail	$26.95	$6.58
DLO Jam Jacket White Case with Cord Management for Nano Model 009-1410 - Retail	$19.95	$5.58
Trust Alarm Clock Radio for iPod Model SP-2993Wi - Retail	$99.99	$10.73
MONSTER iSlimCharger for iPod Model AISCHGRIP - Retail	$29.99	$6.58
GRIFFIN Reflect Mirrored Chrome-Finish Pink Case Model 8139-NREFLCTP - Retail	$21.95	$0.00
GRIFFIN Desktop Stand For Portable Computers Model 1093-CURV2 - Retail	$39.99	$7.15
MIZCO iPod Video Case Model ASPEN-NAVY - Retail	$16.99	$5.58
MONSTER ICable 7Ft. cable for iPod Model AICIP7 - Retail	$29.99	$5.58
Microsoft Office Mac Media Edtion 2008 - Retail	$408.95	$0.00
BELKIN In-Desk Dock for iPod Model F5U255-GR-KIT - Retail	$39.99	$5.58
Kensington Bundle for Apple Laptop Model N90335 - Retail	$69.95	$8.54
I-O DATA Leather Wallet White Model PRIE-TWAL-03G5 - Retail	$39.99	$5.58
BOSE&#174; iPod Accessory Model SoundDock&#174; Battery Black - Retail	$89.00	$0.00
EREPLACEMENTS iPod Mini Replacement Battery Model EC003 - Retail	$34.95	$5.58
Speck MacBook 13&quot; See Thru - BLUE Model MB13-BLU-SEE - Retail	$34.99	$5.58
macally Full Channel Auto &amp; Home FM Transmitter/Charger for iPod Model POD-FMTF - Retail	$29.95	$5.58
CORE CASES Aluminum Case For iPod nano 2G Model AN-2311-Lava Red - Retail	$9.95	$0.00
JENSEN Docking Spearker Station for iPod Black Model JISS-330-BK - Retail	$69.95	$0.00
Allume Systems Faxstf Pro for Mac OS 10.3.9 - Retail	$42.95	$0.00
rocstor 120GB 5400 RPM 2.5&quot; USB 2.0 / IEEE 1394 / eSATA External Hard Drive Model B225E5-01 - Retail	$123.99	$0.00
GRIFFIN ExpressCard/34 Slot 5-in-1 Card Reader Model 1095-XCRDR - Retail	$17.99	$5.58
iSkin touch for iPod touch Black and Blue Model ISK-TCH-GA70 - Retail	$26.95	$0.00
Adobe Illustrator CS3 For MAC - Retail	$582.95	$0.00
DLO Jam Jacket with Cord Management for 3rd Gen iPod nano - clear Model 009-8410 - Retail	$19.95	$6.58
i.Sound Black Time Travel Sound System for iPod Model DGIPOD-374 - Retail	$49.95	$7.15
Punch! Software Home Design Studio Pro - Retail	$204.95	$0.00
VANGUARD Genuine leather Case for iPod nano Model Mondo 4/black - Retail	$19.95	$0.00
CTA Digital Black Hard Case For iPod Video With Belt Clip Model IP-HCVBL - Retail	$9.99	$5.58
GEAR HEAD 1.3MP WebCam Bonus Headset With Microphone Model WC830I - Retail	$54.95	$0.00
ALTEC LANSING inMotion Portable Audio System Model iM500 - Retail	$99.95	$6.58
Delapod Blue Gilmore Purse for iPod Model ip03turq/blue - Retail	$39.95	$6.58
Macware Logo Design Studio MAC - Retail	$24.95	$0.00
MARWARE Sport Grip for nano - Black Model 602956002406 - Retail	$4.95	$5.58
GRIFFIN FireWave Surround Sound For Mac Model 4019-FIRESS - Retail	$60.50	$5.58
VANGUARD Genuine leather Case for iPod nano Model Mondo 4/white - Retail	$14.95	$5.58
DLO MetalShell  for 3rd Generation iPod nano - Red Model 002-3435 - Retail	$16.95	$6.58
I-O DATA Leather Case Red w/ Hook for iPod Video Model PRIE-AMB-01G5 - Retail	$49.99	$5.58
maxell iPod Digital Ear Buds P-8 Model P-8 - Retail	$14.99	$5.58
DLO Jam Jacket with Cable Management for 80GB iPod Classic - clear Model 008-1823 - Retail	$19.95	$6.58
mophie Mueva Wraptor Nano - Blue (2nd Gen) Model MUE-WPT-N2-BLU - Retail	$24.99	$5.58
intego Personal Backup X4 Single User - Retail	$52.95	$0.00
macally Leather Holster for iPod nano 3G Model METRO - Retail	$13.95	$5.58
Rosewill White Case For iPod nano 2nd Model RSC-004 - Retail	$4.99	$0.00
LQ GRAPHICS Photo To Movie - Retail	$42.95	$0.00
iHome Deluxe Table AM/FM Radio for iPod Model iH14D - Retail	$79.99	$7.15
XtremeMac Clear Plastic Case For iPod video 60G Model IPV-MS6-00 - Retail	$16.95	$5.58
GRIFFIN vizor - Leather case for iPod video 60GB (Brown) Model 9332-5GLBRN60 - Retail	$16.95	$5.58
PROSOFT Data Rescue II for Mac - Retail	$84.95	$0.00
BluNa White iPod Nano Audio Adapter Model CC3315-43 - Retail	$49.95	$5.58
rocstor RocPort 4U 60GB 5400 RPM 2.5&quot; USB 2.0 External Hard Drive Model B15365-01 - Retail	$93.99	$0.00
i.Sound Orange Audio Dock in Gift Box for iPod Shuffle 2G Model DGIPOD-674 - Retail	$21.95	$5.58
APPLE DVI to ADC Display Adapter Model M8661LL/B - Retail	$99.99	$7.15
I-O DATA TAG Black Leather Case Model PRIE-TAG-02NA - Retail	$29.99	$5.58
SCOSCHE 2nd Generation Nano RF Remote control with Built in FM transmitter Model NRFM2 - Retail	$66.95	$5.58
Cavalry CAXR 160GB 5400 RPM 2.5&quot; USB 2.0 / eSATA External Hard Drive With OTB Model CAXR25160 - Retail	$144.99	$0.00
CTA Digital Super Sonic Sound Pod for iPod Model IP-AMS - Retail	$79.95	$10.73
Apple iMac MA878LL 24&quot; WUXGA Intel Core 2 Duo 2.4GHz Dual Core 1GB 320GB ATI Radeon HD 2600 PRO Mac OS X v10.5 Leopard - Retail	$1,794.99	$23.80
matias 12&quot;-15&quot; Laptop Armor Stretch Bag Model BA1215U - Retail	$44.99	$7.15
macally MacBook Leather Protective Cover - Red Model BookShellR - Retail	$19.99	$6.58
LACIE Rugged ALL-Terrain 250GB 5400 RPM 2.5&quot; USB 2.0 / IEEE 1394a / 1394b External Hard Drive Model 301291 - Retail	$243.99	$0.00
BELKIN Black Deluxe Leather Case for iPod 4G Model F8Z007 - Retail	$19.99	$5.58
AVB iPod Shuffle Travel Pack Model UT-C-01 - Retail	$19.95	$5.58
PROSOFT Drive Genius 2 - Retail	$59.95	$0.00
EMC DANTZ Retrospect 6.0 Server - Retail	$549.95	$0.00
Crucial 1GB (2 x 512MB) DDR2 667 (PC2 5300) ECC Fully Buffered Dual Channel Kit Memory for Apple Server &amp; Mac Pro - Retail	$84.99	$5.58
iRam 2GB DDR2 667 (PC2 5300) Memory For Apple Notebook - Retail	$46.99	$5.58
DLO Power Bug for iPod Shuffle Model 008-7546 - Retail	$11.95	$5.58
CTA Digital Sound Awake Clock Radio Speaker for iPod Model IP-SAS - Retail	$59.99	$7.48
Adobe Illustrator CS3 For Mac Freehand Upgrade - Retail	$194.95	$0.00
BookEndz Dock for the 2000 PowerBook G3 Model BE-00300 - Retail	$79.95	$0.00
APPLE wired Mighty Mouse Model MB112LL/A - Retail	$39.99	$6.58
Unreal Tournament 2004 Games MacSoft - Retail	$24.99	$5.58
CTA Digital Pink Skin Case with Armband For iPod nano 2Gen Model IP-H2NPI - Retail	$14.99	$6.58
iRam 1GB DDR 333 (PC 2700) Memory For Apple Notebook - Retail	$59.99	$5.58
Kingston 1GB DDR2 533 (PC2 4200) Memory for Apple Notebook - Retail	$26.99	$5.58
iLuv premium stereo earphones Model i201BLK - Retail	$9.95	$5.58
iSkin evo4 Duo for iPod Classic 80GB Black Model EV04BK-A - Retail	$29.95	$5.58
SimpleTech 2GB (2 x 1GB) DDR2 667 (PC2 5300) ECC Fully Buffered Dual Channel Kit Memory for Apple Mac Pro - Retail	$109.99	$5.58
iSkin Duo Case for iPod Nano 3 Gen Purple Model DUON3G-PE - Retail	$24.95	$0.00
i.Sound Luxury White Case for iPod nano Model DGIPOD-332 - Retail	$16.95	$5.58
XtremeMac Black/Gray Durable silicone case for iPod classic 160GB Model IPC-TA6-30 - Retail	$24.95	$5.58
DLO Jam Jacket with Cord Management for 3rd Gen iPod nano - black Model 009-8409 - Retail	$19.95	$6.58
BELKIN TuneBase FM for iPod nano Model F8Z063 - Retail	$79.95	$5.58
i.Sound Black Universal Full Frequency FM Transmitter for iPod Model DGIPOD-998 - Retail	$44.95	$0.00
Kensington Wireless Desktop Set - Titanium Model Ci70 - Retail	$64.99	$5.58
iSkin evo4 Duo for iPod Classic 80GB Pink Model EV04PK-A - Retail	$29.95	$5.58
ABT iJet iJet for iPod nano 1Gen Model IJETNANO-B - Retail	$31.99	$5.58
Adobe Creative Suite 3 Design Premium For Mac Upsell - Retail	$1,579.95	$0.00
DLO Action Jacket White Case for iPod Nano Model 008-9999 - Retail	$24.95	$5.58
APPLE .Mac 5.0 - Retail	$79.00	$0.00
Trust Portable Sound Station for iPod Model SP-2986Bi - Retail	$84.99	$10.73
Battlefield 1942 Deluxe Editon Mac Games ASPYR - Retail	$34.95	$5.58
SoNNeT Battery For 1st &amp; 2nd Generation iPods Model BAT-1G2G - Retail	$24.99	$5.58
BookEndz Docking Station for 13&quot; MacBook - White Model BE-MB13W - Retail	$139.99	$7.15
GEAR HEAD Wireless Optical Mouse Model OM5500WR - Retail	$39.95	$0.00
acomdata E5 500GB 7200 RPM 3.5&quot; USB 2.0 / IEEE 1394a w/PushButton Backup External Hard Drive Model HD500UFAPE5-72 - Retail	$156.99	$0.00
iLuv MP3 CD Vertical Loading Hi-Fi Audio System w/ For iPod Model i9200BLK - Retail	$239.99	$13.57
Adobe Creative Suite 3 Design Standard For Mac Upgrad - Retail	$388.95	$0.00
DLO Jam Jacket with Cord Management case  for iPod Touch - black Model 008-1819 - Retail	$19.95	$6.58
iSkin Duo Case for iPod Nano 3 Gen Black Model DUON3G-BK - Retail	$24.95	$5.58
iHome Boom Box for iPod &amp; Shuffle with 6 FM Radio Presets and remote(Silver) Model ih31S - Retail	$74.95	$8.10
Delapod Black Clutch Style for iPod Model ip01black - Retail	$25.95	$5.58
I.R.I.S Readiris Pro 11 MAC - Retail	$104.95	$0.00
i.Sound White Universal Full Frequency FM Transmitter for iPod Model DGIPOD-984 - Retail	$44.95	$0.00
Kingston 2GB DDR2 667 (PC2 5300) Memory for Apple Notebook - Retail	$53.99	$5.58
LACIE Rugged ALL-Terrain 120GB 5400 RPM 2.5&quot; USB 2.0 / IEEE 1394a / 1394b External Hard Drive Model 301015 - Retail	$149.99	$0.00
Kensington Micro FM Transmitter for iPod Model 33361 - Retail	$44.95	$5.58
BeLight SOFTWARE Art Text - Retail	$43.95	$0.00
iSkin Duo Case for iPod Nano 3 Gen Red Model DUON3G-RD - Retail	$24.95	$5.58
iMainGo Silver Portable Speaker System and Case For iPod Model 06SWB01 - Retail	$39.99	$5.58
BELKIN TuneDeck for iPod nano Model F8Z064 - Retail	$39.95	$5.58
SimpleTech 2GB (2 x 1GB) DDR2 667 (PC2 5300) ECC Fully Buffered Dual Channel Kit Memory For Apple - Retail	$119.99	$5.58
iLuv Quiet and Comfortable Noise Canceling Headphones Model i901 - Retail	$36.95	$0.00
GRIFFIN Audio/Video Cable for iPod Model 9623-HMCKIT - Retail	$14.95	$5.58
BELKIN TuneBase FM for iPod mini Model F8V7097 - Retail	$54.95	$5.58
Kingston 2GB (2 x 1GB) DDR 400 (PC 3200) Dual Channel Kit Memory for Apple Desktop - Retail	$123.99	$5.58
XEROX Maintenance Kit For Phaser 5500 Model 109R00731 - Retail	$419.99	$10.19
Adobe After Effects CS3 For Mac - Retail	$986.95	$0.00
macally FM Transmitter &amp; Charger for iPod Model ICEFM - Retail	$24.99	$5.58
Speck ToughSkin Case for the new 2nd gen iPod nano Model NN2-BLK-TS - Retail	$21.95	$0.00
iHome Portable Speaker Case for iPod &amp; Shuffle Model iH19NP - Retail	$64.95	$7.15
Cygnett GrooveStation Pro Mini Wireless FM transmitter with charger Model CY-A-GSP - Retail	$9.95	$5.58
DLO VideoShell Clear Stylish Plastic Case For iPod Video Model 009-0617 - Retail	$10.95	$5.58
Quickverse Mac 2007 White Box Edition - Retail	$31.95	$0.00
GRIFFIN iTrip Auto Universal Plus FM Transmitter and Car Charger Model 7259-TRIPUNP - Retail	$36.95	$5.58
SimpleTech SimpleDrive PRO 750GB 7200 RPM 3.5&quot; USB 2.0 / IEEE 1394a External Hard Drive (designed by Pininfarina) Model SP-UF35/750 - Retail	$198.95	$5.58
iLuv Genuine leather case for your iPod with video (30GB, 60GB, 80GB) Model i106BBLU - Retail	$19.99	$5.58
Cyber Acoustics White 3 Piece Subwoofer &amp; Satellite Speaker System Model A-210 - Retail	$249.99	$21.18
