FileMaker Bento Family Pack - Retail	$90.95	$0.00
Speck Active Sport Armband Lite for iPod nano Model NN2-ARM - Retail	$26.95	$0.00
The Sims 2 Nightlife Macintosh Version Game ASPYR - Retail	$32.95	$5.58
macally Portable iPod Stereo Speakers Model IP-A111 - OEM	$19.95	$5.58
intego Personal Backup X5 - Single User - Retail	$39.95	$0.00
GRIFFIN Universal case for iPod, MP3 player, cell phone Model 8074-CALRLB - Retail	$16.95	$5.58
Microsoft PowerPoint Mac 2008 - Retail	$199.95	$0.00
Contour ShuttlePRO V.2 - 15 Button Jog &amp; Shuttle Multimedia Control Surface with alloy Jog wheel - Retail	$74.99	$6.58
Apple Mac Pro MA970LL/A Intel Xeon 2.8GHz Quad Core 2GB 320GB ATI Radeon HD 2600 XT Mac OS X v10.5 Leopard - Retail	$2,794.99	$28.64
Speck iPod nano ToughSkin Armor Case Model NN3-BLK-TSA - Retail	$24.99	$5.58
DLO Action Jacket Blue Case for iPod Nano Model 003-4447 - Retail	$24.95	$5.58
JENSEN Docking Digital Music System for iPod Black Model JIMS-85-BK - Retail	$69.95	$0.00
APPLE Mac OS X 10.5.1 Leopard Family Pack - Retail	$180.00	$0.00
Contour Case For iPod video Model ISEEV60 - Retail	$19.95	$5.58
MICROMAT DiskStudio - Retail	$43.95	$0.00
iLuv USB power adapter for your iPod Model i107 - Retail	$16.95	$5.58
Transcend 1GB DDR2 667 (PC2 5300) ECC Fully Buffered Memory for Apple Mac Pro - Retail	$49.99	$5.58
G-TECH G-DRIVE - Q 500GB 7200 RPM 3.5&quot; USB 2.0 / IEEE 1394a / IEEE 1394b / eSATA External Hard Drive Model 913003-01 - Retail	$285.99	$0.00
GRIFFIN Home Media Center for iPod Model 9801-TCENTER - Retail	$99.95	$0.00
EMC DANTZ Retrospect 6.0 Desktop - Retail	$88.95	$0.00
Marketcircle Billings 2 - Retail	$46.95	$0.00
APPLE Final Cut Express 4 - Retail	$169.00	$0.00
EREPLACEMENTS Apple Macbook Pro 17&quot; Notebook Battery Model MA458LLA - Retail	$109.99	$6.58
Microsoft Office Standard 2004 for Mac Student and Teacher Edition - Retail	$129.95	$0.00
VANGUARD Swing Series cases for iPod nano Model Swing 35/black - Retail	$9.95	$5.58
Elgato EyeTV Hybrid US - Mac Accessory - Retail	$139.99	$0.00
DLO Sport-Ready and Armband for iPod Shuffle (2nd Gen) Model 008-1619 - Retail	$19.99	$5.58
Cyber Acoustics Digital Docking Speaker System Model A-303 - Retail	$149.95	$0.00
LACIE Mobile Design by F.A. Porsche 250GB 5400 RPM 2.5&quot; USB 2.0 / IEEE 1394a External Hard Drive Model 301287 - Retail	$196.99	$0.00
SoNNeT Fusion D500P E-Series 7200 RPM 3.5&quot; eSATA External Hard Drive for Expandability Model FUS-D5P-00TB - Retail	$499.95	$0.00
BELKIN White Flip Case for 5G iPod Model F8Z069-WHT - Retail	$24.95	$5.58
iLuv Black Stereo Docking System Model i277BLK - Retail	$139.95	$0.00
ALTEC LANSING Mobile Speaker System for iPods Model iM11 - Retail	$49.95	$0.00
CTA Digital iPod Video Skin Case Model IP-HVC - Retail	$9.99	$5.58
DLO Black Sport-Ready Case, Belt Clip &amp; Armband for Nano Model 002-0010 - Retail	$24.99	$5.58
RADIAN iBlast Speakers for iPod Model RS0526 - Retail	$57.99	$7.48
GRIFFIN Reflect Case for iPod touch Model 8168-ITREFLCT - Retail	$19.95	$0.00
Rosewill Black Silicone Case for iPod Touch with Screen Protector Model RSC-035 - Retail	$8.99	$5.58
macally Black PODCASE iPod Waistband Carrying Case Model CBIPODWB - Retail	$12.99	$5.58
VANGUARD Genuine leather Case for iPod Video Model Mondo 6C/white - Retail	$14.95	$0.00
BELKIN Black Leather Folio for iPod classic Model F8Z207-KR - Retail	$29.95	$5.58
APPLE iLife '08 Family Pack - Retail	$85.00	$0.00
iSkin eVo4 Duo for iPod Classic 80GB Red Model EV04RD-A - Retail	$29.95	$5.58
DETTO Move2Mac Parallel to USB - Retail	$119.95	$0.00
mophie Mueva Wraptor Three Pack (Shuffle 2nd Gen)  Clear-Smoke-Blue Model MUE-WPT-S2-CP2 - Retail	$19.99	$5.58
Creative Xdock &amp; X-Fi Wireless Music System Bundle for iPod Model 70SB085000009 - Retail	$199.95	$0.00
DLO iBoom Travel Graphite speaker system for iPod Model 007-7080 - Retail	$79.95	$6.58
Logitech mm32 Black Portable Speakers For iPod Model 970218-2403 - Retail	$79.99	$7.15
BeLight SOFTWARE Printfolio - Retail	$77.95	$0.00
DLO Red VideoShell SE Case for iPod Video Model 009-1442 - Retail	$12.95	$5.58
BOSE&#174; SoundDock&#174; Portable Digital Music System Black Model SoundDock&#174; Black - Retail	$399.00	$0.00
macally Cordless Stereo Headset for iPod nano 2G Model MTUNE-N2 - Retail	$24.99	$5.58
rocstor 160GB 5400 RPM 2.5&quot; USB 2.0 / eSATA External Hard Drive Model B227F5-01 - Retail	$127.99	$0.00
iLuv High-fidelity multimedia system with BluePin for iPod Model i199BLK - Retail	$199.99	$8.10
XtremeMac Translucent Durable silicone case For iPod nano 3G Model IPN-TAA-00 - Retail	$19.95	$6.58
EXTENSIS Suitcase Fusion Upgrade - Retail	$49.95	$0.00
iLuv FM transmitter with integrated car adapter for your iPod Model i707BLK - Retail	$59.99	$5.58
MARWARE Silicone case for the 1st gen iPod shuffle, Green Color Model 602956001966 - Retail	$2.99	$5.58
LACIE Big Disk Extreme+ 1TB 7200 RPM 3.5&quot; USB 2.0 / IEEE 1394a / 1394b External Hard Drive Model 301199U - Retail	$319.99	$0.00
Kingston 4GB (2 x 2GB) DDR2 667 (PC2 5300) Dual Channel Kit Memory for Apple Notebook - Retail	$109.99	$5.58
MARWARE SportGrip for iPod shuffle,   Black Color Model 602956001904 - Retail	$5.99	$5.58
Speck iPod Touch SeeThru Hard Case with Holster Model IT-RED-SEE - Retail	$26.95	$0.00
Rise of Nations Gold Edition Mac Games DESTINEER - Retail	$29.95	$5.58
CTA Digital Portable Dual Speaker For iPod Model IP-ASP - Retail	$14.99	$6.58
Targus 15&quot; radius Messenger Model TSM040US - Retail	$79.95	$7.48
XtremeMac Crystal Clear Protection for iPod nano 3G Model IPN-MSB-00 - Retail	$16.99	$5.58
CTA Digital Sound Scale Model IP-RSS - Retail	$59.95	$5.58
APPLE wireless Mighty Mouse Model MB111LL/A - Retail	$69.99	$7.15
Apple iPod classic Silver 160GB Model MB145LLA - Retail	$344.00	$0.00
VMware Fusion - Retail	$64.95	$0.00
DLO Jam Jacket for Nano-Black Model 002-0012 - Retail	$4.95	$5.58
XEROX Magenta Standard Capacity Toner Cartridge For Phaser 6120 Model 113R00691 - Retail	$64.99	$7.15
I-O DATA PRIE Black TuneOrganizer for all iPods Model PRIE-PDORGLE-BLK - Retail	$49.99	$5.58
SimpleTech 1GB (2 x 512MB) DDR 400 (PC 3200) Memory For Apple Desktop - Retail	$69.99	$5.58
TRICOD Light Blue Silicon Case  for iPod Video 30GB Model CVR-IPODASILBL - Retail	$4.99	$5.58
mushkin 2GB (2 x 1GB) DDR2 667 (PC2 5300) Dual Channel Kit Memory for Apple Notebook - Retail	$56.99	$5.58
BOSE&#174; SoundDock&#174; Portable Bag - Retail	$59.00	$0.00
XtremeMac MicroMemo Recorder for nano 2G Silver US Model IPN-MIC-20 - Retail	$44.99	$5.58
mophie Black belt clip for iPod Video 60G/80G Model RLO-RT-560-BLK - Retail	$18.99	$5.58
Tekkeon Home Media Center with On-TV Navigation for iPod Model ND2000 - Retail	$129.99	$6.58
mophie Mueva Wraptor Nano - Pink (2nd Gen) Model MUE-WPT-N2-PNK - Retail	$24.99	$5.58
CTA Digital Skin Case with Armband Clear For iPod nano 2Gen Model IP-H2NC - Retail	$14.99	$6.58
The Movies Games NAVARRE CORPORATION - Retail	$42.95	$5.58
JVC Digital Music Speaker System for ipod Model NX-PS1 - Retail	$209.99	$10.73
BOSE&#174; SoundDock&#174; Digital Music System White - Retail	$269.00	$0.00
Adobe Creative Suite 3 Web Standard Mac Upsell - Retail	$788.95	$0.00
i.Sound MAX White Speaker System Model DGIPOD-950 - Retail	$79.95	$0.00
iMainGo Pink Portable Speaker System and Case For iPod Model 06PWB01 - Retail	$39.99	$5.58
DLO Blue VideoShell SE Case for iPod Video Model 009-1447 - Retail	$24.95	$5.58
Speck MacBook Pro 15&quot; See Thru-BLACK Model MB15-BLK-SEE - Retail	$49.99	$6.58
BookEndz Docking Station for 15&quot; MacBook Pro Model BE-MBP15 - Retail	$299.99	$7.48
Adobe InDesign CS3 For Mac - Retail	$679.95	$0.00
CTA Digital iPod Orb Speaker Model IP-RS2 - Retail	$34.99	$6.58
iLuv 8.4&quot; TFT LCD Portable DVD w/iPod Dock Model i1155 - Retail	$249.99	$5.58
i.Sound Clear Jeli Sleeve for iPod video 60/80GB Model DGIPOD-965 - Retail	$11.95	$5.58
Microsoft Excel Mac Upgrade 2008 - Retail	$89.95	$0.00
Kingston 512MB DDR 266 (PC 2100) Memory for Apple Server - Retail	$34.99	$5.58
I-O DATA PRIE TUNEWALLET sienna for 5G Model PRIE-TWAL-04G5 - Retail	$39.99	$5.58
Kingston 512MB DDR 333 (PC 2700) Memory for Apple Notebook - Retail	$36.99	$5.58
BELKIN Leather pouch, compatible with iPod mini Model F8E579-PNK-APL - Retail	$19.95	$5.58
BELKIN Power Dock for iPod Model F8Z122 - Retail	$29.99	$5.58
iKlear iPod, MacBook &amp; MacBook Pro Cleaning Kit Model iK-iPod - Retail	$12.99	$5.58
roxio Popcorn 3 Mac - Retail	$39.95	$0.00
i.Sound Black Car Charger with Apple Pin for iPod Model DGIPOD-662 - Retail	$16.95	$5.58
KEYSPAN Remote for iTunes Model URM-15T - Retail	$34.99	$5.58
SoNNeT USB Car Charger For iPod Model IPOD-12V-CHG-B - Retail	$14.95	$5.58
iRam 2GB (2 x 1GB) DDR2 667 (PC2 5300) ECC Fully Buffered Dual Channel Kit Memory For Apple Mac Pro - Retail	$96.99	$0.00
ALTEC LANSING Powered Audio System Model M602BLK - Retail	$139.95	$9.08
iHome Portable Sport Case for iPod &amp; Shuffle Model iH13B - Retail	$44.95	$7.15
APPLE GarageBand Jam Pack: Symphony Orchestra - Retail	$90.00	$0.00
CTA Digital Travel Kit for iPod Nano and iPod Video Model IP-NVTK - Retail	$39.95	$5.58
Rosewill Black Case For iPod video 30G &amp; iPod Classic 80GB Model RSC-007 - Retail	$4.99	$0.00
Kensington FM Transmitter for iPod Model K33411US - Retail	$59.95	$5.58
GRIFFIN Black Hard shell Leather Case for 3rd Gen iPod nano Model 8170-NELNFMB - Retail	$24.99	$5.58
GRIFFIN High Quality Stereo Microphone for iPod Model 9734-ITALK30-2 - Retail	$39.95	$5.58
macally Protective Sleeve for iPod nano 1st gen, White &amp; Green Model ICESUITN - Retail	$14.95	$5.58
Adobe Production Premium CS3 For Mac Upsell - Retail	$1,184.95	$0.00
CIRCUS PONIES NoteBook v2.0 - Retail	$39.95	$0.00
Logitech mm32 White Portable Speakers for iPod Model 970218-0403 - Retail	$79.95	$6.58
i.Sound MAX Black Speaker System Model DGIPOD-959 - Retail	$79.95	$7.15
GRIFFIN Polycarbonate Case for iPod nano Model 9733-NCLEAR - Retail	$14.95	$5.58
Logitech NuLOOQ Professional NuLOOQ Professional Series Model 965162-0403 - Retail	$74.99	$5.58
macally Portable Stereo Speakers for iPod nano (White) Model IP-N111 - Retail	$9.99	$5.58
XtremeMac Crystal Clear Protection for iPod touch Model IPT-MSA-00 - Retail	$24.95	$5.58
iHome Portable Speaker Case for iPod &amp; Shuffle Model iH19NL - Retail	$64.95	$7.15
EMC DANTZ Retrospect Backup 6.0 Workgroup - Retail	$349.95	$0.00
Call of Duty Deluxe Editon Mac Games ASPYR - Retail	$34.95	$5.58
Adobe Illustrator CS3 For Mac Upgrade - Retail	$195.95	$0.00
GRIFFIN Nano Kit Bundle for 1st Generation iPod nano Model 9903-NANOB4 - Retail	$39.95	$0.00
mushkin 4GB (2 x 2GB) DDR2 667 (PC2 5300) ECC Fully Buffered Dual Channel Kit Memory for Apple Server &amp; Mac Pro - Retail	$193.99	$5.58
AquaMinds NoteTaker v1.9 - Retail	$61.95	$0.00
BELKIN Black Silicone Sleeve for iPod classic 80GB Model F8Z210-BLK - Retail	$19.95	$5.58
CTA Digital AC USB Charger for iPod Model IP-USC - Retail	$14.95	$5.58
BELKIN Kickstand Case for iPod video Model F8Z068-PNK - Retail	$24.95	$5.58
BELKIN Carabiner Case for iPod nano, White Model F8Z057-WHT - Retail	$19.95	$5.58
rocstor ROCPRO 200U 160GB 7200 RPM 3.5&quot; USB 2.0 External Hard Drive Model G154FU-01 - Retail	$83.99	$0.00
DLO VideoShell for 5G iPod with video Model 009-0610 - Retail	$19.95	$5.58
EREPLACEMENTS iPod MP3 Player AC Adapter Model M8636-3G - Retail	$19.99	$5.58
BELKIN Auto Kit for iPod w/ Dock Connector Model F8V7058-APL - Retail	$39.95	$5.58
XtremeMac Black/Pink Protection w/ Style &amp; Substance for iPod touch Model IPT-TWB-50 - Retail	$16.95	$5.58
Rosewill Clear Silicone Case for iPod Classic 80GB with Screen Protector RSC-038 -  Retail - Retail	$6.99	$5.58
PNY 1GB DDR2 667 (PC2 5300) Memory for Apple Notebook - Retail	$26.99	$5.58
iSymphony Micro Music System with Built-in Universal Dock for iPod Model M1 - Retail	$129.99	$14.07
Quake 4 Game ASPYR - Retail	$34.95	$5.58
intego Internet Security Barrier X4 Antispam Edition - Retail	$69.95	$0.00
Kensington 4-in-1 Car Charger for iPod Model 33368 - Retail	$19.95	$6.58
GRIFFIN tempo Armband for iPod Video Model 8051-5GARMB - Retail	$19.95	$5.58
Cygnett GrooveSnooze White docking alarm clock &amp; radio for iPod Model CY-A-GZ - Retail	$69.95	$9.62
BookEndz Dock for the 15&quot; PowerBook G4 Model BE-G415 - Retail	$249.99	$0.00
i.Sound White Car Charger with Apple Pin for iPod Model DGIPOD-661 - Retail	$16.95	$5.58
XtremeMac XtremeHD 13.2 feet HDMI to HDMI Cable Model XHD-4MHH-00 - Retail	$24.99	$5.58
XtremeMac XtremeHD 6.6 Feet HDMI to HDMI Cable Model XHD-2MHH-00 - Retail	$19.99	$0.00
I-O DATA TAG ID Black Leather Case Model PRIE-TID-02NA - Retail	$49.99	$5.58
GRIFFIN white Polycarbonate case with lights for Nano 1G/2G Model 8056-NDSKOW - Retail	$9.95	$0.00
BELKIN Hi-Speed USB 2.0 and FireWire 6-Port Hub for Mac mini Model F5U507 - Retail	$39.99	$5.58
GRIFFIN FM Transmitter And Auto Charger For iPod Model 9501-TRIPCBL - Retail	$69.99	$5.58
Apple 3rd Gen iPod nano Silver 4GB Model MA978LLA - Retail	$149.00	$0.00
Apple 3rd Gen iPod nano Silver 8GB Model MA980LLA - Retail	$194.99	$0.00
iHome Alarm Clock for iPod Model iH4B - Retail	$44.95	$6.58
Zoom Telephonics Transmitters for iPod mini Model 4350-00-68F - Retail	$59.99	$5.58
GRIFFIN White Earphones For Your Mobile Devices Model 9400-TUNBDSW - Retail	$24.95	$0.00
iSkin evo4 Duo for iPod Classic 80GB Silver Model EV04SR-A - Retail	$29.95	$5.58
DLO ActionJacket Black Sport-Ready Case for 5G iPod Model 009-0530 - Retail	$15.95	$5.58
Kensington FX 300 Speaker To Go Model 33388 - Retail	$24.95	$5.58
MONSTER iCarPlay Wireless Plus Model MC125875 - Retail	Price not available	$5.58
BELKIN Pink Remix Metal Case for iPod nano 3G Model F8Z231-PNK - Retail	$24.95	$5.58
XtremeMac Case with NBA Philadelphia 76er's Icon for Ipod video 30GB Model IPV-LTP3-7002 - Retail	$19.95	$5.58
i.Sound Luxury Black Case for iPod video Model DGIPOD-338 - Retail	$16.95	$5.58
I-O DATA Earphone Winder - Tetran Pink Model WIND-TET-01P - Retail	$14.99	$5.58
zicplay Remote + A/V Dock for iPod Black Model ZP-EWOO-BUNDLE-US/BK - Retail	$99.99	$6.58
NYKO iBoost Mini Slim battery pack for iPod mini Model 88057 - Retail	$24.99	$5.58
VANGUARD Genuine leather Case for iPod Video Model Mondo 6C/white - Retail	$14.95	$5.58
rocstor Rocbit 2B 160GB 5400 RPM 2.5&quot; USB 2.0 / IEEE 1394b Encrypted External Hard Drive Model J212F5-40 - Retail	$194.95	$0.00
Adobe After Effects CS3 For Mac Upgrade - Retail	$294.95	$0.00
SimpleTech 4GB (2 x 2GB) DDR2 800 (PC2 6400) ECC Fully Buffered Dual Channel Kit Memory For Apple - Retail	$350.00	$5.58
Adobe Master Collection CS3 for Mac - Retail	$2,399.99	$0.00
Marketcircle Daylite Version 3.0 - Retail	$119.95	$0.00
Miraizon Cinematize 2.0 - Macintosh - Retail	$54.95	$0.00
Panasonic BlueTooth Headphones with Remote Control Model RP-BT10-K - Retail	$139.95	$0.00
GRIFFIN Black Leather Case for iPod touch Model 8166-ITELNCVB - Retail	$19.95	$5.58
Kensington Universal FM Transmitter for MP3 Players Model K33383 - Retail	$39.95	$5.58
BELKIN Folio Case for iPod nano, Blue Model F8Z058-BLU - Retail	$24.95	$5.58
CTA Digital 2.1 iPOD Speaker System Model IP-HTS - Retail	$199.99	$24.24
iHome Speaker System with Dock for iPod-White Model iH80W - Retail	$99.99	$7.48
I-O DATA Leather Case Brown w/ Hook - PRIE Ambassador for iPod nano Model PRIE-AMB-04NA - Retail	$39.99	$5.58
Rosewill Black Silicone Case for iPod Classic 160GB with Screen Protector RSC-039 -  Retail - Retail	$6.99	$5.58
macally Black PODCASE iPod armband carrying case Model CBIPODAB - Retail	$14.99	$5.58
Call of Duty 2 Game ASPYR - Retail	$43.95	$5.58
BELKIN Clear Acrylic Case for iPod nano 2nd generation Pink Model F8Z141-PNK - Retail	$19.95	$5.58
DLO Jam Jacket Black Case with cord management for 5G iPod Model 009-1412 - Retail	$19.95	$5.58
MARWARE TrailVue Cases for iPod Mini, Purple/Lt. Blue Color Model 602956001782 - Retail	$16.99	$5.58
EREPLACEMENTS Apple Powerbook Laptop Battery Model M6385GA - Retail	$89.95	$6.58
GRIFFIN FM Transmitter And Car Charger For iPod Model 4030-ROAD - Retail	$84.99	$5.58
DLO VideoShell  for iPod Touch-clear Model 008-1001 - Retail	$18.95	$6.58
MARWARE Sport Grip Backwinder case for iPod Video 60GB Model 602956002840 - Retail	$6.95	$5.58
Microsoft Office Mac Home and Student 2008 Tech SKU - Retail	$139.95	$0.00
iRam 512MB PC133 Memory For Apple Desktop - Retail	$41.99	$5.58
DLO Black/Tan Twister  for 1st and 2nd Gen iPod Nano Model 009-1404 - Retail	$24.95	$5.58
Logitech AudioStation for iPod Model 970217-0403 - Retail	$99.95	$0.00
acomdata PROdrive 1.5TB 7200 RPM 3.5&quot; USB 2.0 / IEEE 1394a / 1394b External Hard Drive Model PS-550 - Retail	$399.95	$9.08
iMainGo Blue Portable Speaker System and Case For iPod Model 06BBWB01 - Retail	$39.99	$5.58
Techworks by Buffalo 256MB DDR2 533 (PC2 4200) Memory for Apple Desktop - Retail	$19.99	$5.58
i.Sound Dual Charge For iPod Requires USB Cable Model DGIPOD-352 - Retail	$19.95	$6.58
Age of Empires III Games MacSoft - Retail	$43.95	$5.58
Kingston 4GB (2 x 2GB) DDR2 667 (PC2 5300) Dual Channel Kit Memory for Apple Notebook - Retail	$99.99	$0.00
maxell iPod Cassette Adapter P-10 Model 191210 - Retail	$14.95	$5.58
BELKIN iPod video flip top sleeve with belt clip (Pink) Model F8Z123-PNK - Retail	$19.99	$5.58
I-O DATA Leather Case Red w/ Hook Model PRIE-AMB-01NA - Retail	$34.99	$5.58
Adobe Photoshop CS3 For Mac Upgrade - Retail	$195.95	$0.00
Apple M9177LL/A Silver 20&quot; 14ms Widescreen WSXGA+ Mac Display - Retail	$594.00	$16.46
Adobe Flex Builder 2 for Mac w/Charting - Retail	$72.95	$0.00
i.Sound Green Audio Dock in Gift Box for iPod Shuffle 2G Model DGIPOD-673 - Retail	$21.95	$5.58
mophie RELO2 (2G Nano) PINK- base case included Model RLO-SQ-N2-PNK - Retail	$24.99	$5.58
Apple new iPod shuffle Blue 1GB Model MB227LLA - Retail	$49.00	$5.58
BELKIN Carabiner Case for iPod nano, Blue Model F8Z057-BLU - Retail	$16.99	$5.58
mushkin 2GB DDR2 800 (PC2 6400) ECC Fully Buffered Memory For Apple  XSERVE - Retail	$109.99	$5.58
Targus 13&quot; radius Vertical Messenger Model TSM043US - Retail	$49.99	$7.15
mushkin 2GB (2 x 1GB) DDR2 667 (PC2 5300) ECC Fully Buffered Dual Channel Kit Memory for Apple Server &amp; Mac Pro - Retail	$117.99	$0.00
i.Sound Audio Vault for iPod Black Model DGIPOD-372 - Retail	$26.95	$6.58
Apple MacBook MB063LL/A Intel Core 2 Duo 2.16GHz 13.3&quot; WXGA 1GB 160GB DVD&#177;R/RW Intel GMA 950 - Retail	Price not available	$10.19
BELKIN Pink Remix Metal Case for iPod classic Model F8Z234-PNK - Retail	$29.95	$6.58
Intriguing Development iRemember Digital Scrapbooking 2.0 - Retail	$35.95	$0.00
BELKIN Blue Sport Armband Plus for iPod nano 3G Model F8Z200-MBL - Retail	$29.95	$5.58
SENNHEISER Headphone for iPod Model PX100W - Retail	$39.95	$0.00
Medal of Honor: Allied Assault War Chest Game ASPYR - Retail	$26.95	$5.58
DLO Jam Jacket Clear Case for iPod Nano Model 002-0000 - Retail	$19.95	$5.58
Adobe Production Premium CS3 For Mac Upgrade - Retail	$789.95	$0.00
MONSTER iCase Travel Pack for iPod Model AITRVLCASE - Retail	$69.99	$7.15
iomega UltraMax 750GB 7200 RPM 3.5&quot; USB 2.0 / IEEE 1394a / IEEE 1394b / eSATA External Hard Drive Model 33988 - Retail	$274.99	$0.00
XEROX High Capacity Print Cartridge For Phaser 3500 Model 106R01149 - Retail	$189.99	$8.54
QUICKERTEK iMac G5 5.5dbi Omni Directional Antenna for Apple iMac G5 Model iMacG5 Ant - Retail	$99.99	$6.58
rocstor ROCPRO 800 AV 250GB 7200 RPM 3.5&quot; USB 2.0 / IEEE 1394a / 1394b External Hard Drive Model G212EA-01 - Retail	$132.99	$0.00
macally Portable Stereo Speakers for iPod devices Model IP-A111B - Retail	$16.99	$5.58
XtremeMac MicroMemo Recorder for nano 2G Black US Model IPN-MIC-00 - Retail	$49.95	$5.58
BELKIN iPOD Nano 2G Blue Silicon Case with Acrylic Top Model F8Z155-BLU - Retail	$19.95	$5.58
mStation 2.1 Stereo Tower Speaker System for iPod Model mTower - Retail	$299.99	$23.31
BookEndz Dock for the 2002 PowerBook G4 Model BE-02G40T - Retail	$124.95	$0.00
Apple MacBook MB063LL/B Intel Core 2 Duo 2.20GHz 13.3&quot; WXGA 1GB 160GB DVD&#177;R/RW Intel GMA X3100 - Retail	$1,494.99	$10.19
CalDigit 2.5TB 7200 RPM 3.5&quot; eSATA External Hard Drive Model S2VR-5B-2500 - Retail	$2,899.99	$0.00
SCOSCHE Nano RF Remote Control Model NRF - Retail	$53.95	$5.58
VANGUARD Swing 53 Blue Case for iPod video 30GB Model Swing 53/Blue - Retail	$9.95	$0.00
DLO Podfolio for 5G iPod Model 009-0500 - Retail	$15.95	$5.58
SPECTORSOFT Spector 3.0 for Mac - Retail	$86.95	$0.00
Zoo Tycoon Complete Collection Mac Games ASPYR - Retail	$36.95	$5.58
i.Sound Audio Vault for iPod Model DGIPOD-371 - Retail	$26.95	$6.58
DLO Jam Jacket Clear Case with cord management for 5G iPod Model 009-1411 - Retail	$19.95	$5.58
CORSAIR 2GB DDR2 667 (PC2 5300) Memory For Apple Notebook - Retail	$57.99	$5.58
Apple MacBook MB061LL/B Intel Core 2 Duo 2.00GHz 13.3&quot; WXGA 1GB 80GB DVD-ROM/CD-RW Combo Intel GMA X3100 - Retail	$1,079.99	$10.19
DLO Action Jacket Green Case for iPod Nano Model 003-4445 - Retail	$24.95	$5.58
CABLES TO GO iPod Compatible Retractable Travel Kit For Most iPod Model 35505 - Retail	$44.95	$0.00
I-O DATA Carrying Wallet White Model PRIE-TWAL-03NA - Retail	$29.99	$5.58
GRIFFIN iClear Shell Case for iPod Classic Model 8155-ICCLR - Retail	$16.95	$5.58
i.Sound White Foldable 4x Portable Speaker for iPod Model DGUN-172 - Retail	$26.95	$0.00
Kingston 512MB DDR 333 (PC 2700) Memory for Apple Desktop - Retail	$35.99	$5.58
BOSE&#174; SoundDock&#174; Portable Digital Music System White Model SoundDock&#174; White - Retail	$399.00	$0.00
Rosewill Black Silicone Case for iPod Classic 80GB with Screen Protector RSC-037 -  Retail - Retail	$6.99	$5.58
Targus SoundUP High Definition Sound Enhancer for iPod and MP3 Players Model AEA03US - Retail	$36.99	$5.58
I-O DATA Leather Case Black w/ Hook Model PRIE-AMB-02G5 - Retail	$49.99	$5.58
i.Sound JeliSleeve for iPod nano 1G Model DGIPOD-960 - Retail	$14.95	$0.00
Cyber Acoustics Neckband Style Headphones Model A9500 - Retail	$24.95	$5.58
IGG SOFTWARE iBank - Retail	$50.95	$0.00
i.Sound Clear Jeli Sleeve for iPod video 30Gb Model DGIPOD-963 - Retail	$11.95	$5.58
NYKO High Performance FireWire (IEEE 1394)  for PC / MAC / iPod Model 88001 - Retail	$9.99	$5.58
KEYSPAN Black AV Dock for iPod Model AV-DK1B - Retail	$69.95	$6.58
DLO Travel Speaker Set + Stand for iPhone and More Model 007-2626 - Retail	$40.95	$9.62
ALTEC LANSING inMotion Portable Audio System Model iM600 - Retail	$129.95	$7.15
iLuv White Stereo audio alarm clock for iPod Model i177WHT - Retail	$79.95	$8.54
Speck iPod Touch SeeThru Hard Case with Holster Model IT-CLR-SEE - Retail	$26.95	$0.00
GRIFFIN Streamline Low-Profile Sport Armband Model 8127-5GSTRLNB - Retail	$29.99	$5.58
I-O DATA Earphone Winder - Tetran Green Model WIND-TET-03G - Retail	$14.99	$5.58
iSkin Duo Case for iPod Nano 3 Gen Pink Model DUON3G-PK - Retail	$24.95	$0.00
I-O DATA Earphone Winder - Tetran Orange Model WIND-TET-04O - Retail	$14.99	$5.58
Kensington RDS FM Transmitter/Car Charger for iPod Model 33364 - Retail	$59.95	$5.58
Command &amp; Conquer Generals Deluxe Editon Game ASPYR - Retail	$52.95	$5.58
rocstor ROCPRO 400 AV 160GB 7200 RPM 3.5&quot; IEEE 1394a External Hard Drive Model G102C8-01 - Retail	$93.99	$0.00
FileMaker Bento - Retail	$44.95	$0.00
matias Matias Slim USB Power Adapter Model UP101 - Retail	$16.95	$5.58
BELKIN Power Adapter for iPod Model F8Z121 - Retail	$24.95	$5.58
MONSTER 10 ft. TVLink for iPod Video and iPod Photo Model AIITVIP10 - Retail	$49.95	$5.58
BELKIN TuneBase FM with ClearScan Model F8Z176 - Retail	$89.99	$5.58
Kensington Deluxe FM Transmitter for iPod Model K33424US - Retail	$79.95	$5.58
SIIG FireWire 800 (1394b) 3-port 64-bit PCI host adapter for Mac and PC Model NN-83M012-S2 - Retail	$53.99	$5.58
AVB Earphones Splitter for iPod Model AI-01 - Retail	$3.99	$5.58
Symantec Norton Personal Firewall 3.0 - Retail	$64.95	$0.00
BELKIN Silver Remix Metal Case for iPod nano 3G Model F8Z231-SLV - Retail	$24.99	$5.58
macally Protective Leather Case for iPod nano 3G Model DIVO - Retail	$19.95	$0.00
BELKIN Persimmon/Bone Leather Folio for iPod touch Model F8Z227-OT - Retail	$29.99	$6.58
Zoom Telephonics Transmitters for iPod Model 4354-00-68F - Retail	$59.99	$5.58
I-O DATA Leather Wallet Red Model PRIE-TWAL-01G5 - Retail	$39.99	$5.58
mushkin 2GB DDR2 667 (PC2 5300) Memory for Apple Notebook - Retail	$49.99	$5.58
Speck MacBook Pro 15&quot; See Thru-PINK Model MB15-PNK-SEE - Retail	$34.99	$6.58
CTA Digital Wireless Audio Signal Transmitter Model IP-AST - Retail	$99.99	$6.58
Cygnett GrooveStation Mini Wireless FM transmitter for iPod Model CY-A-GSS - Retail	$9.95	$0.00
MARWARE Silicone case for the 1st gen iPod shuffle, Red Color Model 602956001997 - Retail	$2.99	$5.58
Speck Green All-in-one carrying case For shuffle Model SHF2-CC-GRN - Retail	$19.95	$6.58
APPLE In-Ear Headphones For iPod Model M9394G/A - Retail	$34.00	$5.58
BELKIN Kickstand Case for iPod video Model F8Z068-WHT - Retail	$24.95	$5.58
Logitech AudioStation Express for iPod Model 970329-0403 - Retail	$79.95	$8.10
Waawoo Technology Wow-Pen Eco 100 Silver Model WP011S - Retail	$29.99	$5.58
Apple iMac MA877LL 20&quot; WSXGA+ Intel Core 2 Duo 2.4GHz Dual Core 1GB 320GB ATI Radeon HD 2600 PRO Mac OS X v10.5 Leopard - Retail	$1,494.99	$18.51
BeLight SOFTWARE Swift Publisher - Retail	$43.95	$0.00
Kingston 2GB (2 x 1GB) DDR2 667 (PC2 5300) Dual Channel Kit Memory for Apple Notebook - Retail	$49.99	$5.58
MONSTER iCarPlay Wireless 200 FM Transmitter with AutoScan Model AIPFMCH200 - Retail	$89.95	$5.58
iLuv Black Portable audio system for iPod Model i552BLK - Retail	$79.95	$9.08
Kingston 2GB DDR2 667 (PC2 5300) Memory for Apple Notebook - Retail	$49.99	$5.58
XtremeMac Black/Gray Protection w/ Style &amp; Substance for iPod touch Model IPT-TWB-30 - Retail	$16.95	$5.58
BELKIN TuneBase FM for iPod Model F8Z049-BLK - Retail	$79.95	$5.58
GRIFFIN iClear Shell Case for iPod touch Model 8167-ITCLR - Retail	$16.95	$5.58
QUICKERTEK iQuicky USB Wireless Transceiver for iMacs Model 27XVR-IUSB - Retail	$189.99	$6.58
