HAL LEONARD CORPORATION Classic Rock Trackpak - Retail	$27.95	$0.00
Microsoft Office Mac Home and Student 2008 - Retail	$129.95	$0.00
Apple iPod touch 8GB Model MA623LLA - Retail	$294.00	$5.58
iRam 256MB PC133 Memory For Apple Notebook - Retail	$33.99	$0.00
DLO Jam Jacket for 60GB iPod ( Black ) Model 009-0522 - Retail	$19.95	$5.58
I-O DATA PRIE TUNEWALLET Sienna for nano Model PRIE-TWAL-04NA - Retail	$29.99	$5.58
Speck MacBook 13&quot; See Thru - RED Model MB13-RED-SEE - Retail	$34.99	$6.58
Adobe Acrobat Professional v 8.0 Mac Upgrade, Pro version to Pro version. - Retail	$144.95	$0.00
BOSE&#174; Sounddock&#174; Digital Music System Black - Retail	$269.00	$0.00
macally iKey Slim Combo Model IKEY5COMBO - Retail	$39.99	$7.15
maxell Stereo FM Transmitter for iPod &amp; iPod mini Model P-13 - Retail	$19.99	$5.58
ABT iJet iJet Two-Way LCD Remote for iPod Model IJET2WAY-W - Retail	$79.95	$5.58
NOW SOFTWARE Now Up To Date &amp; Contact V5.12 mac - Retail	$109.95	$0.00
ColorVision Spyder2 Spyder2 CVS2E100 Quick, Easy, Accurate Monitor Calibration Model CVS2E100 - Retail	$64.99	$5.58
rain i360&#176; Turntable for iMac (White) Model 10005 - Retail	$39.99	$7.48
MONSTER iSplitter 200 Mini Y-Adapter for iPod Model AICYP200 - Retail	$19.95	$5.58
Rosewill 3 in 1 Silicone Case for iPod 3rd Gen Nano with Screen Protector RSC-042 - Retail	$11.99	$5.58
CHRONOS SoHo Business Cards 1.0 - Retail	$27.95	$0.00
GRIFFIN vizor - Case for iPod video 30GB (Gray) Model 9337-NLGRY30 - Retail	$16.95	$5.58
BELKIN For iPod nano Model F8Z060-WHT - Retail	$14.95	$5.58
BELKIN Stereo Link Cable for iPod, 7 ft. Model F8V235-07GLD-AP - Retail	$12.99	$5.58
GRIFFIN Wireless Access Point for Mac Model 1092-XPRSD - Retail	$14.99	$5.58
pacific DESIGN Navy Leather iPod Nano Flip Case Model PD0437 - Retail	$10.95	$0.00
XEROX Black High Capacity Toner Cartridge For Phaser 6120 Model 113R00692 - Retail	$89.99	$7.15
mushkin 1GB DDR 400 (PC 3200) Memory for Apple Desktop - Retail	$55.99	$0.00
XEROX 110 Volt Maintenance Kit For Phaser 4500 Model 108R00600 - Retail	$249.99	$9.08
SoNNeT Keyborad Covers Capapace Model KP-ALW - Retail	$14.99	$5.58
BELKIN Protective Overlays for iPod video Model F8Z085 - Retail	$7.95	$5.58
RhinoSkin iPod Video 30GB Aluminum Hardcase Model 00615 - Retail	$19.95	$5.58
GRIFFIN AC Charger for Mobile Devices Model 7260-PBLKUNB - Retail	$24.95	$6.58
GRIFFIN Hi-Way Carry your iPod Hi-Fi in style Model 8052-HIWAY - Retail	$39.95	$8.54
DLO Clear Shell Case for 2nd Gen iPod Nano Model 008-1621 - Retail	$7.98	$5.58
iRam 512MB DDR2 667 (PC2 5300) Memory For Apple Notebook - Retail	$11.99	$5.58
mophie Mueva Wraptor Nano - Black (2nd Gen) Model MUE-WPT-N2-BLK - Retail	$18.99	$5.58
macally Cordless Stereo Headset for iPod nano 1st Gen Model MTUNE-N - Retail	$19.99	$5.58
Logitech Desktop S 530 Laser for Mac Model 967664-0403 - Retail	$79.99	$7.48
Waawoo Technology Wow-Pen Traveler 2.4 GHz RF-Red Model WP020-R - Retail	$59.99	$5.58
I-O DATA Leather Case Brown w/ Hook - PRIE Ambassador FOR iPod 5G Model PRIE-AMB-04G5 - Retail	$49.99	$5.58
Speck SeeThru Hard Shell for 15&quot; MacBook Pro Model MB15-AQU-SEE - Retail	$39.95	$6.58
BELKIN Blue Sport Armband Plus for iPod touch Model F8Z223-MBL - Retail	$29.95	$5.58
Close Combat: First to Fight Games MacSoft - Retail	$16.95	$5.58
iRam 1GB DDR2 533 (PC2 4200) ECC Memory For Apple Sever - Retail	$38.99	$5.58
GRIFFIN FM Transmitter with Dock Connector for iPod Model 9781-TRP30BK-2 - Retail	$39.95	$5.58
Rollercoaster Tycoon 3 Game ASPYR - Retail	$43.95	$5.58
Apple iPod touch 16GB Model MA627LLA - Retail	$394.00	$5.58
iHome Boom Box for Apple iPod &amp; Shuffle with FM Radio, Presets, and Remote Model ih31W - Retail	$79.99	$9.08
MONSTER iCase Travel Pack for iPod Model 127036 - Retail	$59.95	$5.58
intego Internet Security Barrier X5 Antispam Edition - Single User - Retail	$82.95	$0.00
BELKIN iPod video flip top sleeve with belt clip (Gray) Model F8Z123-GRY - Retail	$19.99	$5.58
Star Wars Battlefront Mac Games ASPYR - Retail	$34.95	$5.58
BELKIN TuneFM for iPod nano Model F8Z061 - Retail	$49.95	$5.58
XtremeMac TuffWrap Accent for iPod Video 60GB Black/Red Model IPV-TA6-10 - Retail	$24.95	$5.58
RADIAN iBlast powerful speaker system Black Model RS2526 - Retail	$57.99	$8.10
Apple new iPod shuffle Purple 1GB Model MB233LLA - Retail	$49.00	$5.58
Kingston 1GB DDR 333 (PC 2700) Memory for Apple Notebook - Retail	$95.99	$5.58
iRam 4GB (2 x 2GB) DDR2 667 (PC2 5300) ECC Fully Buffered Dual Channel Kit Memory For Apple Mac Pro - Retail	$144.99	$0.00
macally Yellow PODCASE iPod Armband Carrying Case Model CBIPODAY - Retail	$14.99	$5.58
acomdata E5 500GB 7200 RPM 3.5&quot; IEEE 1394a External Hard Drive Model HD500FE5-72 - Retail	$146.99	$0.00
Adobe Fireworks CS3 For Mac - Retail	$294.95	$0.00
Rosewill Pink Case For iPod video 30G &amp; iPod Classic 80GB Model RSC-012 - Retail	$4.99	$0.00
DLO Black Sport-Ready Neoprene Case for iPod touch Model 008-1000 - Retail	$10.95	$0.00
rain iLap for 13&quot; Macbook Model 10023 - Retail	$44.99	$6.58
GRIFFIN Morror Finish Flip-Stand Case for iPod video Model 8121-5GCSCHR - Retail	$16.95	$6.58
Adobe Creative Suite 3 Web Standard Mac Upgrade - Retail	$393.95	$0.00
Intuit Quicken 2007 for Mac - Retail	$69.95	$0.00
PARLIANT PhoneHerald Broadcast Dialer - Retail	$319.95	$0.00
APPLE Mac OS X 10.5 Leopard Family Pack - Retail	$171.00	$0.00
Microsoft Excel Mac 2008 - Retail	$199.95	$0.00
Rosewill Green Case For iPod video 60GB &amp; iPod Classic 160GB Model RSC-016 - Retail	$4.99	$0.00
EREPLACEMENTS Powerbank Rechargeable Battery Model PowerPal - Retail	$59.99	$6.58
LG WM3431HS 2.44 Cu.Ft. Titanium Washer/Dryer Combo - Retail	$1,599.95	n/a
BELKIN Black Sport Armband for iPod nano 3G Model F8Z202-KG - Retail	$29.95	$5.58
Macware Logo Design Studio Pro - Retail	$56.95	$0.00
iSkin Duo skin for 2G iPod nano Pearl White Model ISK-DUON2G-PE - Retail	$19.95	$5.58
CalDigit 3.75TB 7200 RPM 3.5&quot; eSATA External Hard Drive Model S2VR-5B-3750 - Retail	$3,799.99	$0.00
iHome Portable Travel Alarm Clock for Apple iPod Shuffle Model iH18W - Retail	$20.95	$7.15
BELKIN Pink Leather Folio Case for iPod touch Model F8Z227-RK - Retail	$29.95	$6.58
BELKIN Sport Armband for iPod nano Model F8Z153-KG - Retail	$19.99	$5.58
SimpleTech 2GB (2 x 1GB) DDR2 800 (PC2 6400) Dual Channel Kit Memory For Apple - Retail	$155.99	$5.58
Rosewill Gray Case For iPod video 60GB &amp; iPod Classic 160GB Model RSC-017 - Retail	$4.99	$0.00
Speck iPod nano Active-Fit Armband Model NN3-WHT-FIT - Retail	$24.95	$5.58
GRIFFIN kalamari Suction-cup case for video iPods Model 8078-5G6KLMRI - Retail	$16.95	$5.58
GRIFFIN Sport Armband For 2nd Generation iPod Shuffle Model 8126-SHFTMPOB - Retail	$14.95	$5.58
GRIFFIN Pink Reflect Case for iPod 3rd Gen nano Model 8171-NREFLCTP - Retail	$19.95	$5.58
Speck iPod Touch TechStyle Pinstripe Case Model IT-BLK-PIN - Retail	$26.95	$0.00
ALTEC LANSING Mobile Speaker System for iPods Model iM9 - Retail	$124.95	$0.00
LACIE Design by F.A. Porsche 500GB 7200 RPM 3.5&quot; USB 2.0 / IEEE 1394a External Hard Drive Model 301210U - Retail	$175.99	$0.00
FREEVERSE Comic Life Deluxe - Retail	$26.95	$0.00
SIIG Dual-port FireWire CardBus adapter for Mac notebooks Model NN-PCMM12-S3 - Retail	$26.99	$5.58
CTA Digital Dock Station Model IP-DOC - Retail	$29.95	$5.58
GRIFFIN iVault Armor for your Shuffle, Purple Color Model iVault Purple - Retail	$4.95	$0.00
Speck iPod Touch ToughSkin Case Model IT-BLK-TS - Retail	$19.95	$5.58
Speck Canvas Sport Case For iPod Video Model IV-WHITE-CV - Retail	$24.95	$0.00
VANGUARD Swing 64 Blue Case  for iPod video 30/60G Model Swing 64/blue - Retail	$9.95	$0.00
DLO Power Pack for iPod Model 009-1213 - Retail	$30.95	$6.58
CTA Digital Sound BLAST 2.1 iPod speaker system Model IP-SBS - Retail	$99.95	$11.84
Autodesk Cleaner 6.5 for Mac - Retail	$539.95	$0.00
iSkin Duo Case for iPod Nano 3 Gen Blue Model DUON3G-BE - Retail	$24.95	$5.58
CTA Digital 12V Car Charger for iPod Model IP-CLA - Retail	$9.95	$5.58
mophie RELO RATCHET Black belt clip for iPod Video 30GB Model RLO-RT-530-BLK - Retail	$18.99	$5.58
QUICKERTEK nQuicky PCMCIA/CardBus Upgrade Kit Model nCard-PCMCIA - Retail	$129.99	$5.58
EZQUEST Monsoon Slim 40GB 5400 RPM 2.5&quot; USB 2.0 / IEEE 1394a External Hard Drive Model B04464 - Retail	$89.99	$0.00
XtremeMac Crystal Clear Protection for iPod classic Model IPC-MSB-00 - Retail	$16.95	$5.58
BookEndz Docking Station for 15&quot; MacBook Pro (2nd Generation) - Firewire 800 Model BE-MBP15F - Retail	$299.99	$7.48
athena Direct Radiating iPod Dock Sound System Model iVoice - Retail	$79.99	$7.48
mophie Mueva Wraptor Nano - Green (2nd Gen) Model MUE-WPT-N2-GRN - Retail	$24.99	$5.58
MARWARE TrailVue Cases for iPod Mini, Purple/Lt. Blue Color Model 602956001744 - Retail	$16.99	$5.58
iSkin touch for iPod touch Black and Red Model ISK-TCH-GH78 - Retail	$24.95	$5.58
Adobe Photoshop Extended CS3 For Mac Upgrade - Retail	$339.95	$0.00
DLO Use Your Favorite Headphones with iPhone Model 007-0000 - Retail	$9.95	$5.58
Apple new iPod shuffle Silver 1GB Model MB225LLA - Retail	$49.00	$4.99
macally Compact External Li-ion Battery Model JboxMini - Retail	$19.99	$5.58
ALTEC LANSING High Definition Noise-Free Headphone Model IM716 - Retail	$129.99	$5.58
iLuv Battery booster with silicone case for your iPod with video (30GB) Model i603WHT - Retail	$54.99	$5.58
Adobe Flex Builder 2.0 with Charting for Mac - Retail	$679.95	$0.00
CalDigit SATA ExpressCard Model FASTA-1ex - Retail	$79.99	$5.58
DLO TuneStik with Remote Model 006-2001 - Retail	$59.95	$6.58
DLO HybridShell  for iPod Touch - Clear with Grey/Silver Dots Model 002-3440 - Retail	$22.95	$6.58
MONSTER FM Transmitter for iPod Model AIPFMCHPSSB - Retail	$79.99	$5.58
Battery-Biz FM Transmitter/Extended Battery/Case kit for iPod Model DRPWFMN - Retail	$39.99	$5.58
APPLE Wireless Ultra-Thin Keyboard (Bluetooth) Model MB167LL/A - Retail	$79.99	$5.58
DLO Action Jacket White Sport-Ready Case for 5G video iPods Model 009-0567 - Retail	$24.95	$5.58
I-O DATA Leather Wallet Black Model PRIE-TWAL-02G5 - Retail	$39.99	$5.58
ColorVision Spyder2 Spyder2 CVS2P100 Professional's Choice for Monitor Calibration Model CVS2P100 - Retail	$219.99	$5.58
Waawoo Technology Wow-Pen Eco 100 Blue Model WP011B - Retail	$34.95	$5.58
MARINER MacJournal V4 - Retail	$33.95	$0.00
iomega MINIMAX 750GB 7200 RPM 3.5&quot; USB 2.0 / IEEE 1394a External Hard Drive Model 33956 - Retail	$244.99	$0.00
Speck Clear Super-Tough Rubberized Case For iPod touch Model IT-CLR-TS - Retail	$24.95	$0.00
iSkin Cruise Pack - 2G iPod Nano Skin Model N2G-CRU - Retail	$24.95	$5.58
GRIFFIN Clear Hard Plastic Case for iPod video 30GB/60GB/80GB Model 9973-CLR5G - Retail	$14.95	$5.58
Rosewill Green Case For iPod video 30GB &amp; iPod Classic 80GB Model RSC-009 - Retail	$4.99	$0.00
QUICKERTEK AirPort Base Station Antenna for All Apple AirPort Base Station Model ABS ANT - Retail	$99.99	$6.58
EREPLACEMENTS Apple iPod Battery 3rd Generation Model 6160159 - Retail	$39.99	$5.58
iLuv Genuine leather case for your iPod with video (30GB, 60GB, 80GB) Model i106BPNK - Retail	$16.95	$5.58
SummitSoft Font Library - Retail	$39.95	$0.00
ABT iJet iJet for iPod nano 1Gen Model IJETNANO-W - Retail	$31.99	$5.58
VANGUARD Tamil 4 White Case  for iPod nano Model Tamil 4/white - Retail	$9.95	$5.58
XtremeMac Crystal Clear Protection for iPod nano 3G Model IPN-MSA-00 - Retail	$24.95	$5.58
Microsoft Office Mac 2008 Tech Sku - Retail	$347.95	$0.00
GRIFFIN iMate Universal ADB To USB Adapter Model 2001-ADB - Retail	$32.99	$5.58
CTA Digital iPod Earbuds Model IP-EBW - Retail	$9.95	$5.58
DLO Black Leather Sleeve w/Clip &amp; Screen Protector for iPod touch Model 008-100 - Retail	$24.95	$5.58
DLO Jam Jacket Black Case with Cord Management for Nano Model 009-1409 - Retail	$19.95	$5.58
GRIFFIN AMPLIFI 2.1 sound System for iPod Model 1200-ITSPKR - Retail	$129.95	$9.62
DLO Entertainment Dock with On-TV Navigation+Remote for iPod Model 009-9900 - Retail	$149.95	$7.15
GRIFFIN vizor - Leather case for iPod video 30GB (Red Mahogany) Model 9329-5GLRM30 - Retail	$14.95	$5.58
ATO iSee 360 Video Recorder for iPod Black Model iSee 360 - Retail	$219.99	$5.58
Adobe Creative Suite 3 Design Premium For Mac Upgrade - Retail	$589.95	$0.00
ALTEC LANSING inMotion Portable Audio for iPod and iPod mini Model iM3CBLK - Retail	$124.99	$7.15
Waawoo Technology Wow-Pen Traveler 2.4 GHz RF-White Model WP020-W - Retail	$69.95	$5.58
Dora the Explorer: Animal Adventures Games MacSoft - Retail	$16.95	$5.58
KEYSPAN RF Remote for Front Row Model ER-RF1 - Retail	$29.99	$6.58
Apple iPod classic Black 160GB Model MB150LLA - Retail	$344.00	$0.00
Kingston 1GB DDR 333 (PC 2700) Memory for Apple Desktop - Retail	$63.99	$5.58
SimpleTech 1GB (2 x 512MB) DDR2 667 (PC2 5300) ECC Fully Buffered Dual Channel Kit Memory For Apple - Retail	$81.99	$5.58
XEROX Print Cartridge For Phaser 3500 Model 106R01148 - Retail	$134.99	$8.54
roxio Toast 8 Titanium - Retail	$78.95	$0.00
macally Protective Sleeve for iPod video Model ICESUITV - Retail	$9.99	$5.58
Graphic Simulations Corp. iStopMotion - Retail	$37.95	$0.00
SoNNeT iFreq FM transmitter and car charger Model FMT-IFREQ - Retail	$64.99	$5.58
LACIE d2 Quadra 500GB 7200 RPM 3.5&quot; USB 2.0 / IEEE 1394a / IEEE 1394b / eSATA External Hard Drive Model 301110U - Retail	$179.95	$0.00
macally MacBook Protective Pad - White Model BookPadW - Retail	$5.99	$5.58
GRIFFIN trio nano - 3-in-1 case (Gray) Model 9326-NOGRY - Retail	$14.99	$5.58
SimpleTech 2GB DDR2 667 (PC2 5300) Memory for Apple Notebook - Retail	$48.99	$5.58
CalDigit 4 port PCI-x SATA 3G Host Adapter Model FASTA-4x - Retail	$279.95	$6.58
APPLE GarageBand Jam Pack: Remix Tools - Retail	$93.00	$0.00
BeLight SOFTWARE Live Interior 3D - Retail	$69.95	$0.00
Delapod Manhattan Green Striped handbag for iPod Model ip02clearwater - Retail	$51.95	$6.58
HAL LEONARD CORPORATION Hip-hop Trackpak - Retail	$27.95	$0.00
DLO Action Jacket Pink Case for iPod Nano Model 003-4446 - Retail	$24.95	$5.58
iLuv Battery booster with silicone case for your iPod with video (30GB) Model i603BLK - Retail	$54.99	$0.00
Logitech Pure-Fi Anywhere Compact Speakers for iPod Model 984-000006 - Retail	$84.95	$0.00
BookEndz Dock for the 2001 PowerBook G4 Model BE-01G40T - Retail	$94.95	$0.00
DLO Nylon Holster w/ Belt Clip + Inner Pocket for iPod touch Model 008-1821 - Retail	$12.95	$5.58
DLO Transpod In-Car Cradle/FM Transmitter, Black Model 009-3031 - Retail	$55.95	$5.58
Kingston 1GB DDR 400 (PC 3200) Memory for Apple Desktop - Retail	$59.99	$5.58
MIZCO Explorer iPod Video Case Black Model V-EXPLORER-BK - Retail	$19.99	$5.58
XtremeMac 2M Analog Audio Cable - US Model XHD-2MAA-00 - Retail	$14.99	$5.58
APPLE Mac OS X v10.5.1 Leopard - Retail	$109.00	$0.00
CTA Digital Silver Hard Case for iPod nano 2nd Generation Model IP-H2CNS - Retail	$14.99	$6.58
Microsoft Office 2004 for Mac - OEM	$194.95	$0.00
I-O DATA TAG White Leather Case Model PRIE-TAG-03NA - Retail	$29.99	$5.58
GRIFFIN Charging Kit For iPod Model 9756-PKIT - Retail	$29.95	$5.58
Speck iPod Touch SeeThru Hard Case with Holster Model IT-BLK-SEE - Retail	$24.95	$5.58
MARWARE TrailVue Cases for iPod Mini, Gray/Lt.Blue Color Model 602956001775 - Retail	$16.99	$5.58
DLO Jam Jacket for Nano-Clear Model 002-0005 - Retail	$19.95	$5.58
iRam 2GB (2 x 1GB) DDR2 800 (PC2 6400) ECC Fully Buffered Dual Channel Kit Memory For Apple Mac Pro - Retail	$119.99	$0.00
I-O DATA Earphone Winder - Tetran Yellow Model WIND-TET-02Y - Retail	$14.99	$5.58
Patriot Memory 1GB DDR2 667 (PC2 5300) Memory for Apple Notebook - Retail	$23.99	$5.58
CTA Digital iPod nano Skin Case Model IP-HNAC - Retail	$9.95	$5.58
Speck iPod Touch SeeThru Hard Case with Holster Model IT-PNK-SEE - Retail	$26.95	$0.00
macally Protective Case for iPod nano 3G Model SPORTIVO - Retail	$14.95	$5.58
iRam 4GB (2 x 2GB) DDR2 800 (PC2 6400) ECC Fully Buffered Dual Channel Kit Memory For Apple Mac Pro - Retail	$209.99	$0.00
Contour Showcase for iPod video 60GB Model SH5GV60B02 - Retail	$24.99	$5.58
FREEVERSE Sound Studio 3 - Retail	$59.95	$0.00
DLO Power Bug Charger for iPod Model 002-9983 - Retail	$19.95	$5.58
zicplay Remote + A/V Dock for iPod White Model ZP-EWOO-BUNDLE-US/WH - Retail	$99.99	$5.58
BELKIN TuneTalk Stereo for iPod Model F8Z082-BLK - Retail	$54.95	$5.58
BELKIN Carabiner Case for iPod nano, Fuschia / Black Model F8Z057-FB - Retail	$24.95	$5.58
Microsoft Word Mac 2008 Upgrade - Retail	$96.95	$0.00
ATO iSee Video Recorder w/ Adapter for iPod White Model 360i - Retail	$155.95	$7.15
Rosewill Clear Silicone Case for iPod Classic 160GB with Screen Protector RSC-040 -  Retail - Retail	$6.99	$5.58
Frigidaire FGX831CS 2.7 cu. ft. White Washer/Dryer Combo - Retail	$1,199.95	n/a
EREPLACEMENTS Internal battery For iPod Model 616-0183 - Retail	$29.99	$5.58
BELKIN Pink Silicone Sleeve for iPod classic 80GB Model F8Z210-PNK - Retail	$19.99	$5.58
BELKIN Sports Holster and Armband for iPod nano 2nd generation Black Model F8Z133-BLK - Retail	$19.99	$5.58
XtremeMac Black Compact room audio system + FM radio Model IPD-TMX-10 - Retail	$79.99	$8.10
DLO Gun Metal/Purple 2-Pack VideoShell SE Case for iPod Video Model 009-1441 - Retail	$29.95	$5.58
DLO TransDock Micro FM Transmitter Model 003-8890 - Retail	$42.95	$5.58
rain iLap for 17&quot; MacBook Pro or PowerBook Model 10027 - Retail	$64.95	$6.58
XtremeMac TuffWrap for 30GB iPod video, Single Pack, Translucent White Model IPV-TW3-00 - Retail	$16.95	$5.58
iRam 256MB PC133 Memory For Apple Desktop - Retail	$21.99	$5.58
Adobe Creative Suite 3 Design Standard For Mac - Retail	$1,169.95	$0.00
BELKIN Sports Sleeve for iPod nano Model F8Z060 - Retail	$19.95	$5.58
Cygnett GrooveBuds Chat Comfortable internet chat headset Model CY-3-GBC - Retail	$14.95	$5.58
CORSAIR 1GB DDR2 667 (PC2 5300) Memory for Apple Notebook - Retail	$32.99	$5.58
BELKIN Remix Metal for iPod nano - red - Retail	$24.99	$5.58
Macally 3.5&quot; USB 2.0 Mac Enclosure Model ECO-350U-SB - Retail	$25.99	$0.00
SimpleTech 1GB DDR2 667 (PC2 5300) Memory for Apple Notebook - Retail	$26.99	$5.58
DLO TransDock All-In-One Car Solution For iPod Model 009-3040 - Retail	$99.95	$5.58
DLO Home Entertainment Center For iPod Model 009-9764 - Retail	$84.95	$6.58
Microsoft Office Mac Media Edition 2008 Upgrade - Retail	$246.95	$0.00
BELKIN Black Sport Armband for iPod touch Model F8Z224-KG - Retail	$19.95	$6.58
SANS DIGITAL 500GB 7200 RPM 3.5&quot; USB 2.0 / IEEE 1394a / 1394b External Hard Drive Model MS2C105 - Retail	$374.95	$0.00
GRIFFIN Ultimate sport armband For iPhone &amp; iPod touch Model 8142-IPHSTRLNB - Retail	$24.95	$5.58
The Sims 2 Macintosh Version Game ASPYR - Retail	$42.95	$5.58
GRIFFIN Reflect Mirrored Hard Case for iPod Video Black Model GT-8112-5GREFLCT - Retail	$12.99	$5.58
GRIFFIN RoadTrip Charcoal/FM Transmitter Model 4031-RDGC - Retail	$84.99	$5.58
SENNHEISER Headphone for iPod Model PX200W - Retail	$79.99	$5.58
CTA Digital iPod nano Skin Case Model IP-HNAPI - Retail	$9.99	$5.58
Kensington Pico FM Transmitter for iPod Model 33365 - Retail	$34.95	$5.58
DLO Intelligent Car Charger for iPhone Model 009-5543 - Retail	$19.95	$6.58
Kensington FX 500 Speaker for iPod or MP3 player Model 33390 - Retail	$49.95	$7.15
Speck iPod Touch SeeThru Hard Case with Holster Model IT-GRN-SEE - Retail	$24.95	$5.58
VOX 1TB 5400 RPM 3.5&quot; USB 2.0 / eSATA External Hard Drive Model EXSAR-35B-1T-K - Retail	$369.95	$0.00
GRIFFIN Reflect Case for iPod 3rd Gen nano Model 8161-NREFLCT - Retail	$19.95	$5.58
QUICKERTEK 27dBm Transceiver for Apple AirPort Base Stations Model 27 XVR AE - Retail	$199.99	$5.58
iKlear Micro-Fiber Polishing Cloth Model iK-MKK - Retail	$6.99	$5.58
Joesoft Stox - Mac - Retail	$30.95	$0.00
Microsoft Office Mac 2008 Media Tech Sku - Retail	$449.95	$0.00
macally 17 button remote control for iPod Model IP-A803 - Retail	$39.95	$0.00
intego NetBarrier X5 - Single User - Retail	$49.95	$0.00
macally External Li-ion Battery for iPod devices Model IP-A481 - Retail	$49.95	$5.58
EZQUEST 6 - 9pin FireWire 800 Cable Model C56960 - Retail	$14.99	$0.00
Tekkeon myPower Rechargeable Battery Dock White Model MP1140 - Retail	$44.95	$0.00
Cyber Acoustics Digital Docking Speaker System Model A-302 - Retail	$149.95	$0.00
BELKIN Carabiner Case for iPod nano, Pink Model F8Z057-PNK - Retail	$19.95	$5.58
BELKIN iPod Nano Canvas Holster,Khaki/metalic Bronze Model F8Z127-KB - Retail	$19.95	$5.58
I-O DATA Leather Case White w/ Hook Model PRIE-AMB-03G5 - Retail	$39.99	$5.58
BELKIN iPOD Nano 2G Black Silicon Case with Acrylic Top Model F8Z155-BLK - Retail	$19.95	$5.58
iRam 1GB DDR2 533 (PC2 4200) Memory For Apple Desktop - Retail	$22.99	$5.58
Kensington Stereo Dock for iPod Model 33164 - Retail	$29.95	$6.58
Apple 3rd Gen iPod nano Green 8GB Model MB253LLA - Retail	$194.99	$0.00
BELKIN Folio Case for iPod nano, Black Model F8Z058 - Retail	$24.95	$6.58
SimpleTech 1GB (2 x 512MB) DDR2 667 (PC2 5300) ECC Fully Buffered Dual Channel Kit Memory For Apple - Retail	$81.99	$5.58
CTA Digital Travel Charger Model IP-TBC - Retail	$14.95	$5.58
Targus Mobile Essentials Kit for iPod &amp; MP3 Players Model ABE0202US - Retail	$49.99	$6.58
CORE CASES Aluminum Case For iPod nano 2G Model AN-2311-Onyx Black - Retail	$9.95	$0.00
XtremeMac 2.1 Audio Speaker System Model IPD-TX2-10 - Retail	$119.95	$9.62
iRam 512MB DDR 333 (PC 2700) Memory For Apple Desktop - Retail	$23.99	$5.58
CTA Digital Sport Excercise Waist Belt For Ipod Model IP-BEL - Retail	$8.95	$6.58
Rosewill Pink Case For iPod video 60GB &amp; iPod Classic 160GB Model RSC-019 - Retail	$4.99	$0.00
DLO Pink Shell Case for 2nd Gen iPod Nano Model 008-1622 - Retail	$16.95	$5.58
Kingston 1GB DDR2 667 (PC2 5300) Memory for Apple Notebook - Retail	$24.99	$5.58
Speck iPod nano ToughSkin Armor Case Model NN3-CLR-TSA - Retail	$21.95	$0.00
I-O DATA BOOMTUNE for all iPOD Model BOOM-MINI - Retail	$32.99	$5.58
macally MacBook Protective Pad - Black Model BookPadB - Retail	$9.95	$5.58
SimpleTech 2GB (2 x 1GB) DDR2 800 (PC2 6400) Dual Channel Kit Memory For Apple - Retail	$149.99	$5.58
iLuv Genuine leather case for your iPod with video (30GB, 60GB, 80GB) Model i106BBLK - Retail	$16.95	$5.58
macally Flat Panel Stereo Speaker for iPod Model TunePro - Retail	$129.99	$7.48
Speck MacBook 13&quot; See Thru - PINK Model MB13-PNK-SEE - Retail	$34.99	$5.58
GRIFFIN Blue Reflect Case for iPod 3rd Gen nano Model 8172-NREFLCTB - Retail	$19.95	$5.58
DLO Stereo Cable Kit Model 009-4445 - Retail	$19.95	$5.58
CTA Digital Perfect Sound Noise Reduction Headphones Model IP-HSR - Retail	$29.99	$5.58
THE OMNI GROUP OmniPlan - Retail	$124.95	$0.00
CTA Digital Hard Case For iPod Nano Model IP-HCNPI - Retail	$9.99	$5.58
APPLE Ultra-Thin Keyboard - Wired USB Model MB110LL/A - Retail	$39.99	$5.58
JENSEN Protable Speakers System for iPod Model SMPS-300 - Retail	$20.95	$0.00
XtremeMac Protection w/ Style &amp; Substance for iPod classic 80GB Model IPC-TB8-30 - Retail	$12.95	$5.58
BELKIN Pink/Clear Remix Acrylic Case for iPod Nano 2G Model F8Z154-PKC - Retail	$24.95	$5.58
DLO Auto Charger for Apple iPod White Model 009-5557 - Retail	$11.99	$5.58
BELKIN Tunecast II mobile FM transmitter for iPOD Model F8V3080 - Retail	$39.95	$5.58
Apple iPod classic Black 80GB Model MB147LLA - Retail	$244.00	$0.00
iHome Portable Speaker for iPod Player Model iHM3B - Retail	$24.95	$7.15
BELKIN SportCommand for iPod RF Remote Model F8Z076 - Retail	$79.95	$5.58
Waawoo Technology Wow-Pen Traveler 2.4 GHz RF-Blue Model WP020-B - Retail	$69.95	$5.58
Speck MacBook Pro 15&quot; Canvas Sport - PINK Model MB15-PNK-CV - Retail	$27.99	$6.58
BELKIN TuneBase FM for iPod Model F8Z049 - Retail	$79.95	$5.58
intego Internet Security Barrier X5 Backup Edition - Single user - Retail	$87.95	$0.00
GRIFFIN Black Hard shell Leather Case for iPod touch Model 8169-ITELNFMB - Retail	$29.99	$5.58
Xitel iPod To Home Stereo Dock Kit Model IHFLN-X1-US - Retail	$74.95	$0.00
G.SKILL 2GB DDR2 667 (PC2 5300) Memory For Apple Notebook - Retail	$49.99	$0.00
BELKIN TuneDok Car Holder for iPod Model F8E467 - Retail	$19.95	$6.58
SummitSoft Mac Freelance - Retail	$34.95	$0.00
mophie Relo Base Case Black 5Gen 30GB Model RLO-BC-530-BLK - Retail	$13.99	$5.58
FREEVERSE Lineform - Retail	$59.95	$0.00
mophie Pack for Shuffle 2nd Gen Clear-Pink-Blue Model MUE-WPT-S2-CP1 - Retail	$18.99	$5.58
BELKIN Pink Leather Folio for iPod classic Model F8Z207-RK - Retail	$29.95	$5.58
GEIL 2GB (2 x 1GB) DDR2 667 (PC2 5300) Dual Channel Kit Memory For Apple Desktop - Retail	$66.99	$5.58
APPLE iWork '08 - Retail	$69.00	$0.00
Speck ToughSkin Case for the new 2nd gen iPod nano Model NN2-CLR-TS - Retail	$26.95	$0.00
iHome Portable Speaker Case for iPod &amp; nano &amp; Shuffle Model iH19NS - Retail	$64.95	$7.15
EZQUEST Pro Audio 500GB 7200 RPM 3.5&quot; IEEE 1394a External Hard Drive Model B50560 - Retail	$292.99	$0.00
Kingston 2GB (2 x 1GB) DDR2 533 (PC2 4200) Dual Channel Kit Memory for Apple Desktop - Retail	$53.99	$5.58
SummitSoft Web Ghost - Retail	$27.95	$0.00
acomdata mini Pal 500GB 7200 RPM 3.5&quot; USB 2.0 / IEEE 1394a External Hard Drive Model HD500FPMM-72 - Retail	$195.99	$0.00
BELKIN Clear Acrylic Case for iPod nano 2nd generation Blue Model F8Z141ttBLU-SN - Retail	$19.99	$5.58
Apple MacBook Pro MA895LL Intel Core 2 Duo 2.20GHz 15.4&quot; WXGA+ 2GB 120GB DVD&#177;R/RW NVIDIA GeForce 8600M GT - Retail	$1,994.99	$10.73
KEYSPAN USB High Speed Serial Adapter Model USA-19HS - Retail	$29.99	$5.58
GRIFFIN centerstage Clear Case With Built-in Flip-stand for iPod Model 8068-5GSTNDS - Retail	$16.95	$5.58
I-O DATA TUNEFLIM for iPod 5G Model TUNE-FILM-01G5 - Retail	$5.95	$5.58
GRIFFIN FM Transmitter with Dock Connector for iPod Model 9500-TRIPDA-2 - Retail	$49.99	$5.58
I-O DATA Earphone Winder - Jewel Heart Pink Model JWL-CLIP-HRT2 - Retail	$39.99	$5.58
GRIFFIN AutoPilot Vehicle Control &amp; Charger For iPod Model 9559-AUTOPLTB - Retail	$39.95	$5.58
GEAR HEAD Bluetooth Keyboard &amp; Mouse Model KBL8000WRBT - Retail	$79.99	$0.00
ALTEC LANSING Mobile speaker system for your iPod Model IM5 - Retail	$69.95	$0.00
