BELKIN TuneFM for iPod Model F8Z075-BLK - Retail	$49.95	$5.58
Klipsch iPod Speaker Model iGroove SXT - Retail	$149.99	$9.08
AEC Software Fasttrack Schedule 9.0 Single User - MAC - Retail	$359.95	$0.00
Microsoft Office Word 2004 for Mac Upgrade - Retail	$92.95	$0.00
parallels Desktop 3.0 for Mac - Retail	$59.95	$0.00
iLuv &quot;In-ear&quot; Earphone for Your iPod and Many Other Audio Devices Model i301BLK - Retail	$11.95	$5.58
BELKIN Clear Acrylic and Brushed-Metal Case For iPod Model F8Z115-PNK - Retail	$29.95	$5.58
Speck MacBook Pro 15&quot; See Thru-GREEN Model MB15-GRN-SEE - Retail	$34.99	$6.58
DLO Black Sport-Ready Neoprene Case for iPod nano 3G Model 002-8010 - Retail	$16.99	$5.58
Adobe CS3 Web Premium Mac Upsell - Retail	$1,379.95	$0.00
Microsoft Office Mac 2008 English DVD Standard - Retail	$347.95	$0.00
iSkin touch for iPod touch Black Model ISK-TCH-JE95 - Retail	$24.95	$5.58
Rosewill Clear Black Silicone Case for iPod Nano 3G w/Screen Protector RSC-043 - Retail	$5.99	$5.58
Kingston 4GB (2 x 2GB) DDR2 667 (PC2 5300) ECC Fully Buffered Dual Channel Kit Memory For Apple Mac Pro - Retail	$259.99	$5.58
BELKIN Black Flip Case for 5G iPod video Model F8Z069 - Retail	$24.95	$5.58
JLab MiniBlaster Portable Speaker for iPod nano Gen 1 Model 854291001020 - Retail	$49.99	$5.58
Speck See Thru Lucid  for iPod nano 2nd Gen Clear Model NN2-CLR-SEE - Retail	$19.95	$5.58
elgato Analog/Digital TV Receiver and Video Converter Model EyeTV 250 Plus - Retail	$198.99	$6.58
iRam 2GB DDR2 533 (PC2 4200) Memory For Apple Desktop - Retail	$43.99	$5.58
APPLE MB053LL/A   AirPort Extreme Base Station - Retail	$174.99	$0.00
Kingston 2GB (2 x 1GB) DDR2 667 (PC2 5300) Dual Channel Kit Memory for Apple Notebook - Retail	$49.99	$5.58
Adobe Pagemaker 7.0 2 Mac 1 User - Retail	$77.95	$0.00
Apple MacBook Pro MA896LL Intel Core 2 Duo 2.40GHz 15.4&quot; WXGA+ 2GB 160GB DVD&#177;R/RW NVIDIA GeForce 8600M GT - Retail	Price not available	$10.73
Tiger Woods PGA Tour 2005 Mac Games ASPYR - Retail	$26.95	$5.58
DESTINEER Garage Sale - Retail	$24.95	$0.00
Waawoo Technology Wow-Pen Eco 100 Red Model WP011R - Retail	$34.95	$5.58
Kingston 512MB DDR 266 (PC 2100) Memory for Apple Notebook - Retail	$33.99	$5.58
iSkin Groove Pack for New 2G iPod Nano Model N2G-GRO - Retail	$29.99	$5.58
GRIFFIN vizor - Leather case for iPod video 60GB (Red Mahogany) Model 9333-5GLRM60 - Retail	$16.95	$5.58
BELKIN Flip Case for iPod nano, Blue Model F8Z059-BLU - Retail	$19.95	$5.58
macally Audio &amp; Video Cable for iPod Model AVCABLE - Retail	$7.95	$5.58
DLO Green Shell Case for 2nd Gen iPod Nano Model 008-1623 - Retail	$16.95	$5.58
VANGUARD Swing 64 Orange Case  for iPod video 30/60G Model Swing 64/orange - Retail	$9.95	$0.00
V-MODA Remix M-Class iPod Earphones Blue Steel Model VM-RM-BLUE - Retail	$39.95	$0.00
Apple iMac MA876LL 20&quot; WSXGA+ Intel Core 2 Duo 2.0GHz Dual  Core 1GB 250GB ATI Radeon HD 2400 XT Mac OS X v10.5 Leopard - Retail	$1,194.99	$18.51
Speck See Thru Lucid  for iPod nano 2nd Gen Smoke Model NN2-BLK-SEE - Retail	$19.95	$5.58
iKlear Apple Polish Cleaning Kit Model iK-5MCK - Retail	$13.99	$5.58
Adobe  Creative Suite 3 Web Standard Mac - Retail	$987.95	$0.00
BELKIN Auto Kit for iPod w/ Dock Connector Model F8V7058-APL-BLK - Retail	$34.95	$5.58
Creative Cambridge SoundWorks PlayDock i Model MF8046 - Retail	$174.95	$5.58
GRIFFIN Disko Polycarbonate Case with Lights for iPod Model 8066-5GDSKOW - Retail	$14.95	$0.00
iLuv Audio &amp; Speaker System white Model i188WHT - Retail	$36.95	$8.10
Apple 3rd Gen iPod nano Black 8GB Model MB261LLA - Retail	$194.99	$0.00
GRIFFIN Headphone Splitter with Volume Controls (Black) Model 9688-SMSHARE - Retail	$11.95	$5.58
V-MODA Vibe Noise-Isolating In-Ear Earphones Model VM-V-BLACKCHR - Retail	$99.95	$5.58
MARWARE TrailVue Cases for iPod Mini, Gray/Red Color Model 602956001720 - Retail	$16.99	$5.58
Adobe Freehand MX 11 Mac - Retail	$406.95	$0.00
GRIFFIN vizor - Case for iPod video 60GB (Gray) Model 9338-NLGRY60 - Retail	$14.95	$5.58
THE OMNI GROUP Omnioutliner Pro 3.0 - Retail	$58.95	$0.00
Apple M9179LL/A Silver 30&quot; 14ms Widescreen WUXGA Mac Display - Retail	$1,794.00	$0.00
BELKIN Black/Clear Remix Acrylic Case for iPod Nano 2G Model F8Z154-BKB - Retail	$24.95	$5.58
Apple MacBook Pro MA897LL/A Intel Core 2 Duo 2.40GHz 17&quot; WSXGA+ 2GB 160GB DVD&#177;R/RW NVIDIA GeForce 8600M GT - Retail	Price not available	$11.26
Macware Macfonts MAC - Retail	$24.95	$0.00
Cygnett Portable Speakers For iPod Model CY-3-GC - Retail	$15.95	$5.58
macally Cassette Tape Car Adapter for iPod devices Model POD-TAPE - Retail	$9.95	$5.58
SANS DIGITAL  80GB Hard Drive Enclosure w/9-in-1 Card Reader - Retail	$134.99	$0.00
XtremeMac 3-Pack Scratch-Resistant Screen Protectors for iPod touch Model IPT-TS3-00 - Retail	$9.95	$5.58
Apple iPod touch 32GB Model MB376LL/A - Retail	$494.00	$0.00
iLuv Black Stereo audio alarm clock for iPod Model i177BLK - Retail	$79.95	$8.10
BELKIN White Headphone Splitter for iPod Model F8V234-WHT - Retail	$3.95	$5.58
JENSEN Universal Docking Station Speakers For iPod Model JiSS-80-W - Retail	$30.95	$7.15
Kensington Keyboard for Mac Model 64366 - Retail	$39.99	$6.58
pacific DESIGN Navy iPod 5G/Video Flip Case Model PD0438 - Retail	$11.99	$5.58
Cyber Acoustics Black 3 Piece Subwoofer &amp; Satellite Speaker System Model A-211 - Retail	$249.99	$21.18
BELKIN iPod nano flip top sleeve with lanyard (Gray) Model F8Z124-GRY - Retail	$19.95	$5.58
Speck iPod Classic Active-Fit Armband Model IC-WHT-FIT - Retail	$26.95	$0.00
GRIFFIN iPod Auto Charger Model 9749-PJBLK - Retail	$19.95	$0.00
V-MODA Bass Freq iPod In-Ear Earphones Rocker Red Model VM-BF-RED - Retail	$49.99	$5.58
iRam 1GB DDR 400 (PC 3200) Memory For Apple Desktop - Retail	$47.99	$5.58
BELKIN Blue Silicone Sleeve for iPod nano 3G Model F8Z213-BLU - Retail	$19.95	$5.58
DETTO Move2Mac USB Kit - Retail	$39.95	$0.00
rocstor RocPort 4U 80GB 5400 RPM 2.5&quot; USB 2.0 External Hard Drive Model B15385-01 - Retail	$79.99	$0.00
LACIE Little Disk, Design by Sam Hecht 250GB 5400 RPM 2.5&quot; USB 2.0 / IEEE 1394a External Hard Drive Model 301282 - Retail	$199.99	$0.00
G.SKILL 3GB (2GB + 1GB) DDR2 667 (PC2 5300) Memory For Apple Notebook - Retail	$74.99	$0.00
GRIFFIN Black Leather Case for iPod classic Model 8145-ICELNCVB - Retail	$24.99	$5.58
Microsoft Office 2004 Mac Standard Edition - Retail	$269.95	$0.00
XEROX Cyan Toner Cartridge For Phaser 6120 Model 113R00693 - Retail	$149.99	$7.15
XtremeMac Black Durable silicone case For iPod nano 3G Model IPN-TAA-10 - Retail	$19.95	$5.58
Apple iPod classic Silver 80GB Model MB029LLA - Retail	$244.00	$0.00
iSkin touch for iPod touch Black and Clear Model ISK-TCH-CH38 - Retail	$24.95	$5.58
Epson 1705c White 3LCD Mac Display Built-in Speakers - Retail	$1,149.99	$10.19
DLO Pink/Green 2-Pack VideoShell SE Case for iPod Video Model 009-1440 - Retail	$29.95	$5.58
FREECOM Mobile drive PRO 250GB 5400 RPM 2.5&quot; USB 2.0 / IEEE 1394a External Hard Drive Model 29610 - Retail	$249.99	$6.58
DLO Auto Charger for Apple iPod Black Model 009-5556 - Retail	$11.99	$5.58
macally iKey Slim Model IKEY5 - Retail	$19.99	$6.58
macally Case For iPod nano Model IP-N801 - Retail	$4.99	$5.58
AUDIOVOX Thunder Clock Radio Universal Docking Station Model CE609CR - Retail	$54.95	$0.00
CORSAIR 2GB (2 x 1GB) DDR2 667 (PC2 5300) Dual Channel Kit Memory for Apple Notebook - Retail	$61.99	$5.58
Cygnett 70 W Speaker System w/ Dock Model U-S-IX5B - Retail	$239.95	$9.08
BELKIN Sports Armband for iPod nano Model F8Z105-BLK - Retail	$24.95	$5.58
BELKIN iPod Mobile Power Cord Model F8V7067-APL - Retail	$19.95	$5.58
MARWARE Case for the 1st Gen iPod shuffle, Gray Color Model 602956001911 - Retail	$2.99	$5.58
Kingston 512MB PC133 Memory for Apple Desktop - Retail	$65.49	$5.58
Speck iPod Touch SeeThru Hard Case with Holster Model IT-BLU-SEE - Retail	$26.95	$0.00
BELKIN Black Silicone Sleeve with Armband for iPod classic Model F8Z211 - Retail	$19.95	$5.58
DLO TransCast FM Transmitter Model 009-2007 - Retail	$49.95	$5.58
GRIFFIN Streamline Low-Profile Sport Armband Model 8140-NSTRLNP - Retail	$26.95	$0.00
VANGUARD Swing 53 clear Case for iPod video 30GB Model Swing 53/clear - Retail	$9.95	$0.00
Adobe Dreamweaver CS3 For Mac Upgrade - Retail	$195.95	$0.00
CTA Digital iPod nano Skin Case Model IP-HNABL - Retail	$9.99	$5.58
GEIL 2GB DDR2 667 (PC2 5300) Memory For Apple Desktop - Retail	$52.99	$5.58
Adobe InDesign CS3 For Mac Upgrade - Retail	$195.95	$0.00
i.Sound Sport Case for iPod video Model DGIPOD-994 - Retail	$16.95	$0.00
RhinoSkin iPod Video 60GB/80G Aluminum Hardcase Model 00616 - Retail	$19.99	$5.58
Apple M9178LL/A Silver 23&quot; 14ms Widescreen WUXGA Mac Display - Retail	$894.00	$0.00
BeLight SOFTWARE Business Card Composer - Retail	$34.95	$0.00
JENSEN Universal Docking Digital Music System w/CD For iPod Model JiMS-210-W - Retail	$59.95	$8.10
GRIFFIN AirClick USB remote control for Mac/PC Model 4023-ACUSB - Retail	$39.95	$0.00
iMainGo Black Portable Speaker System and Case For iPod Model 06BWB01 - Retail	$39.99	$5.58
VOX 250GB 7200 RPM 3.5&quot; USB 2.0 / eSATA External Hard Drive Model EXSA-35C-250G5K - Retail	$95.99	$0.00
iLuv White Portable audio system for iPod Model i552WHT - Retail	$79.95	$14.46
iLuv Hi-Fi Audio System w/ For  iPod Docking Station White Model i9200WHT - Retail	$239.99	$12.99
GRIFFIN High Quality Stereo Microphone for iPod Model 9734-ITALK30-2 - Retail	$39.95	$5.58
G.SKILL 1GB DDR2 667 (PC2 5300) Memory For Apple Notebook - Retail	$25.99	$0.00
Rosewill Transparent Silicone Case for iPod Touch with Screen Protector RSC-035 - Retail	$8.99	$5.58
Adobe Creative Suite 3 Design Premium For Mac - Retail	$1,807.95	$0.00
Xitel HiFi-Link for iPod Model IHFL-X1-US - Retail	$79.99	$5.58
Allume Systems Spring Cleaning 9.0 - Retail	$42.95	$0.00
BELKIN Folio Case for iPod nano, White Model F8Z058-WHT - Retail	$19.95	$5.58
Creative Xdock with X-Fi Wireless Streaming for iPod Model SB0850 - Retail	$169.95	$7.15
macally Portable Stereo Speakers for iPod nano 1st Gen (Black) Model IP-N111B - Retail	$9.99	$5.58
DURACELL FM Tran/Ex-Battery/Case for iPod Nano 2nd Gen Model DRPWFMN2 - Retail	$24.95	$0.00
BELKIN Charging Kit for iPod Model F8Z152 - Retail	$34.95	$5.58
I-O DATA Carrying Wallet Black w/WHITE stitch Model PRIE-TWAL-02NA - Retail	$29.99	$5.58
DLO Casual Leather Cases for iPod Nano Model 002-0100 - Retail	$15.95	$5.58
EZQUEST 4 Port eSATA 8X PCI Express Controller Card Model A59984 - Retail	$269.99	$6.58
Speck Black/Gray iPod Case Model IV-BLGY-FLP - Retail	$24.95	$5.58
XtremeMac Protection w/Style &amp; Substance For iPod nano 3G Model IPN-TWB-00 - Retail	$16.95	$5.58
Miraizon Cinematize 2.0 - Macintosh - Retail	$59.95	$0.00
MONSTER iCarPlay Wireless - FM Transmitter for iPods Model AIPFMCH - Retail	$69.95	$0.00
i.Sound Blue Audio Dock in Gift Box for iPod Shuffle 2G Model DGIPOD-672 - Retail	$21.95	$5.58
maxell iPod Back-Up Battery Pack P-2 Model 191202 - Retail	$24.95	$5.58
XEROX Print Cartridge For Phaser 4500 Model 113R00657 - Retail	$219.99	$8.10
GRIFFIN Silver Leather Case for 3rd Gen iPod nano Model 8144-NELNCVS - Retail	$19.95	$0.00
mophie Mophie Wraptor Clear Case for Shuffle 2nd Generation Model MUE-WPT-S2-C - Retail	$14.99	$5.58
GRIFFIN Flexible Docking Cradle with Audio Cable For nano 2G Model 9556-NTFLXAU - Retail	$39.95	$6.58
BELKIN White TuneCast Mobile FM Transmitter for iPod Model F8V367-APL - Retail	$29.95	$5.58
XtremeMac HomeShow Audio/Video Connection Kit for iPod Model IPD-HAV-10 - Retail	$39.95	$5.58
DLO Wireless FM Transmitter + RF Remote for iPod Model 006-2000 - Retail	$59.99	$5.58
GRIFFIN Black Hard shell Leather Case for iPod classic Model 8164-ICELNFMB - Retail	$24.95	$5.58
Adobe Premiere Pro CS3 For Mac Upgrade - Retail	$295.95	$0.00
Apple 3rd Gen iPod nano Blue 8GB Model MB249LLA - Retail	$194.99	$0.00
MARWARE Silicone case for the 1st gen iPod shuffle, Plum Color Model 602956001942 - Retail	$2.99	$5.58
DLO VideoShell Blue Stylish Plastic Case For iPod Video Model 009-0613 - Retail	$10.95	$5.58
i.Sound Pink Audio Dock in Gift Box for iPod Shuffle 2G Model DGIPOD-671 - Retail	$21.95	$5.58
G.SKILL 4GB (2 x 2GB) DDR2 667 (PC2 5300) Dual Channel Kit Memory For Apple Notebook - Retail	$84.99	$0.00
CTA Digital Crystal Case with Ear Buds and Neck Strap for nano 1G Model IP-CCNA - Retail	$14.99	$6.58
DLO Black Shell Case for 2nd Gen iPod Nano Model 008-1625 - Retail	$7.98	$5.58
mophie Relo Base Case for iPod 5Gen 30GB Frost Model RLO-BC-530-FST - Retail	$14.99	$5.58
EREPLACEMENTS iPod battery Model 616-0159 - Retail	$29.95	$5.58
CTA Digital FM Transmitter Model IP-FMT - Retail	$19.95	$5.58
XEROX Print Cartridge For Phaser 4500 Model 113R00656 - Retail	$149.99	$8.10
Patriot Memory 4GB (2 x 2GB) DDR2 667 (PC2 5300) Memory for Apple Notebook - Retail	$82.99	$0.00
iRam 512MB DDR 333 (PC 2700) Memory For Apple Notebook - Retail	$28.99	$5.58
DLO Blue Shell Case for 2nd Gen iPod Nano Model 008-1624 - Retail	$16.95	$5.58
SimpleTech 2GB (2 x 1GB) DDR 400 (PC 3200) Memory For Apple Desktop - Retail	$123.99	$5.58
iomega UltraMax 500GB 7200 RPM 3.5&quot; USB 2.0 / IEEE 1394a / IEEE 1394b / eSATA External Hard Drive Model 33991 - Retail	$197.99	$0.00
LACIE d2 SAFE 500GB 7200 RPM 3.5&quot; USB 2.0 / IEEE 1394a / 1394b External Hard Drive Model 301114U - Retail	$261.99	$0.00
mushkin 4GB (2 x 2GB) DDR2 667 (PC2 5300) Dual Channel Kit Memory for Apple - Retail	$94.99	$0.00
XEROX Drum Cartridge For Phaser 5500 (Up To 60K) Model 113R00670 - Retail	$269.99	$8.10
QUICKERTEK Power Mac G4 5dBi Omni Antenna Model G4 Ant - Retail	$99.99	$6.58
BELKIN AV Cable for 4G/5G iPod (Color LCD) Model F8Z030-12-APL - Retail	$19.95	$5.58
Speck MacBook Pro 15&quot; See Thru-CLEAR Model MB15-CLR-SEE - Retail	$34.99	$5.58
MARWARE Silicone case for the 1st gen iPod shuffle, Yellow Color Model 602956001973 - Retail	$2.99	$5.58
I-O DATA Leather Case Red w/ Hook Model PRIE-TAG-01NA - Retail	$29.99	$5.58
GRIFFIN Utility Case for iPod touch &amp; classic Model Courier - Retail	$24.95	$5.58
DLO Gun Metal VideoShell SE Case for iPod Video Model 009-1445 - Retail	$19.95	$5.58
acomdata E5 320GB 7200 RPM 3.5&quot; IEEE 1394a External Hard Drive Model HD320FE5-72 - Retail	$104.99	$0.00
DLO Red/Blue 2-Pack VideoShell SE Case for iPod Video Model 009-1416 - Retail	$24.95	$5.58
GRIFFIN Reflect Case for iPod classic Model 8160-ICREFLCT - Retail	$19.95	$5.58
G-TECH G-RAID 2 500GB 7200 RPM 3.5&quot; USB 2.0 / IEEE 1394a / 1394b External Hard Drive Model 907205-01 - Retail	$343.95	$0.00
DLO HybridShell  for 3rd Gen iPod nano - clear front, black back Model 002-3436 - Retail	$16.95	$6.58
Speck Canvas Sport Case For iPod nano Model NN-WHITE-CV - Retail	$26.95	$5.58
ALTEC LANSING Superior Noise Isolating earphone for iPod Model IM616 - Retail	$89.95	$5.58
BELKIN Earbud Pads Model F8Z055-5 - Retail	$9.95	$5.58
DLO Jam Jacket with Cord Management for 160GB iPod classic - black Model 008-1825 - Retail	$19.95	$6.58
Microsoft PowerPoint Mac 2008 Upgrade - Retail	$91.95	$0.00
GRIFFIN DirectDeck - Universal Cassette Adapter for iPod Model 7256-DDECK - Retail	$9.95	$5.58
mushkin 2GB (2 x 1GB) DDR2 800 (PC2 6400) ECC Fully Buffered Dual Channel Kit Memory For Apple MacPro - Retail	$134.99	$5.58
GRIFFIN EarJams for iPod Earbuds w/ Carrying Case Included Model 4039-EJAM - Retail	$14.95	$5.58
DLO Jam Jacket with Cord Management for 80GB iPod classic - black Model 008-1824 - Retail	$19.95	$6.58
rocstor ROCPRO 200U 250GB 7200 RPM 3.5&quot; USB 2.0 External Hard Drive Model G154HA-01 - Retail	$105.99	$0.00
DLO Pink VideoShell Case for iPod Video Model 009-0615 - Retail	$19.95	$5.58
Speck iPod nano ToughSkin Case Model NN3-CLR-TS - Retail	$19.95	$5.58
BELKIN Clear Remix Acrylic for iPod nano 3G Model F8Z215 - Retail	$19.95	$5.58
Adobe Contribute CS3 For Mac Upgrade - Retail	$76.95	$0.00
mushkin 2GB (2 x 1GB) DDR2 800 (PC2 6400) ECC Fully Buffered Dual Channel Kit Memory for Apple Server &amp; Mac Pro - Retail	$141.99	$0.00
Waawoo Technology Wow-Pen Eco 100 Pink Model WP011P - Retail	$34.95	$5.58
Crucial 2GB (2 x 1GB) DDR2 667 (PC2 5300) ECC Fully Buffered Dual Channel Kit Memory for Apple Server &amp; Mac Pro - Retail	$109.99	$5.58
BELKIN Silver Remix Metal Case for iPod classic Model F8Z234-SLV - Retail	$29.99	$6.58
Applesauce Polish Ipod Scratch Removal Kit Model APPL-1000 - Retail	$19.99	$0.00
BELKIN TuneBase FM for iPod nano Model F8Z063-BLK - Retail	$79.95	$5.58
GRIFFIN vizor - Leather case for iPod video 60GB (Dark Blue) Model 9334-5GLDBL60 - Retail	$16.95	$5.58
macally Case For iPod Video Model IP-P802 - Retail	$4.95	$5.58
DLO Pink VideoShell SE Case for iPod Video Model 009-1443 - Retail	$19.95	$5.58
GRIFFIN iMic USB Audio Interface Model 9066-IMIC2 - Retail	$39.99	$5.58
CTA Digital Hard Case For iPod Nano Model IP-HCNBL - Retail	$7.95	$5.58
ALTEC LANSING inMotion Portable Audio System Model iMmini - Retail	$29.95	$5.58
iHome Portable Speaker Case for iPod &amp; Shuffle Model iH19NQ - Retail	$64.95	$7.15
e frontier Shade 8 professional for Mac - Retail	$769.95	$0.00
iLuv &quot;In-ear&quot; Earphone for Your iPod and Many Other Audio Devices Model i301WHT - Retail	$14.95	$5.58
GRIFFIN Flexible Auto Charger with Cassette Adapter for iPod Model 9865-TFLEX5G - Retail	$39.95	$5.58
macally MacBook Leather Protective Cover - Black Model BookShellB - Retail	$29.99	$6.58
DLO iBoom Travel White Speaker System for iPod Model 007-7083 - Retail	$79.95	$6.58
CORE CASES Aluminum Case For iPod nano 2G Model AN-2311-Ocean Blue - Retail	$9.95	$0.00
LACIE Design by F.A. Porsche 750GB 7200 RPM 3.5&quot; USB 2.0 / IEEE 1394a External Hard Drive Model 301211U - Retail	$239.99	$0.00
SoNNeT High-capacity iPod Battery (for iPod video 60GB/80GB), 750mAh Model BATG-5G60 - Retail	$19.95	$5.58
mStation 2.1 stereo Black speaker Fo iPod Model ORBBLACK - Retail	$129.99	$8.54
i.Sound Silver Armband for iPod nano Model DGIPOD-997 - Retail	$16.95	$5.58
Miraizon Cinematize 2 Pro Edition - Macintosh - Retail	$129.95	$0.00
XEROX Magenta Toner Cartridge For Phaser 6120 Model 113R00695 - Retail	$149.99	$7.15
BELKIN TuneCast Auto for iPod-Black Model F8V7101-BLK - Retail	$39.99	$5.58
MARWARE TrailVue Cases for iPod Mini, Black/Gray Color Model 602956001737 - Retail	$16.99	$5.58
Adobe Photoshop CS3 For Mac - Retail	$619.95	$0.00
APPLE iLife '08 - Retail	$69.00	$0.00
mophie Mueva IPO - Black Leather (2nd Gen) Model MUE-IPO-N2-BLK - Retail	$24.99	$5.58
mophie RELO BASE CASE- Black (Nano 2nd Generation) Model RLO-BC-N2-BLK - Retail	$9.95	$5.58
macally iPod Speaker and Headphone T-Splitter Model PODDUO - Retail	$9.99	$5.58
Adobe Creative Suite 3 Design Standard For Mac Upsell - Retail	$898.95	$0.00
GRIFFIN Reflect Mirrored Chrome-Finish Blue Case Model 8141-NREFLCTB - Retail	$19.95	$5.58
DLO nanoShell for iPod nano-Clear Model 002-0217 - Retail	$3.95	$5.58
SANS DIGITAL Synology 250GB USB 2.0 / eSATA Single bay Mac Storage Model MAC-DS107E02 - Retail	$350.99	$0.00
XEROX Toner Cartridge For Phaser 5500 Model 113R00668 - Retail	$109.99	$7.15
DLO Jam Jacket 30 for 5G iPod Model 009-0510 - Retail	$19.95	$5.58
iLuv Lightweight Ear Clips for iPod and many Other Devices Model i201 - Retail	$9.95	$5.58
macally Protective Sleeve for iPod video Model ICESUITVB - Retail	$9.95	$0.00
CTA Digital Silver Hard Case For iPod Video With Belt Clip Model IP-HCVS - Retail	$7.95	$5.58
VOX 2TB 5400 RPM 3.5&quot; USB 2.0 / eSATA External Hard Drive Model EXSAR-35B-2T-K - Retail	$559.95	$0.00
BeLight SOFTWARE Disc Cover - Retail	$32.95	$0.00
KEYSPAN ZIP-LINQ Stereo Headset Model KZIPAUDIOCD2W - Retail	$9.95	$5.58
BELKIN Classic Case for 5G iPod Model F8Z071 - Retail	$24.95	$5.58
DLO Action Jacket for iPod Shuffle Model 008-7575 - Retail	$9.95	$5.58
XtremeMac Audio Cable Model XTM-XHD-2MAA-00 - Retail	$12.99	$5.58
BELKIN Clear Acrylic Case w/ Carabiner Clip For iPod Nano 2G Model F8Z130 - Retail	$24.95	$5.58
Macware Email Campaign - Retail	$44.95	$0.00
LACIE Little Disk, Design by Sam Hecht 160GB 5400 RPM 2.5&quot; USB 2.0 / IEEE 1394a External Hard Drive Model 301280 - Retail	$139.99	$0.00
DLO Jam Jacket for 30GB iPod ( Black ) Model 009-0521 - Retail	$19.95	$5.58
CTA Digital iPod Video Skin Case Model IP-HVBL - Retail	$9.95	$5.58
CORE CASES Aluminum Case For iPod nano 2G Model AN-2311-Sterling Silver - Retail	$9.95	$0.00
EREPLACEMENTS Apple PowerBook G4 Battery Model M9326G-A - Retail	$119.95	$5.58
GRIFFIN remote control for iPod Model 9502-CLK30 - Retail	$36.95	$5.58
I-O DATA PRIE pink jewel nano Model PRIE-JWL-NA01 - Retail	$19.99	$5.58
mushkin 1GB DDR2 667 (PC2 5300) Memory for Apple Notebook - Retail	$23.99	$5.58
Adobe Flash CS3 Pro For Mac Upgrade - Retail	$195.95	$0.00
Adobe Acrobat Professional v 8.0 Mac Upsell ; v8.0 Standard to Pro - Retail	$149.95	$0.00
SimpleTech 8GB (2 x 4GB) DDR2 667 (PC2 5300) ECC Fully Buffered Dual Channel Kit Memory for Mac Pro - Retail	$825.99	$5.58
BELKIN Protective Overlays for iPod nano Model F8Z086 - Retail	$7.95	$5.58
DLO Jam Jacket 60 for 5G iPod Model 009-0520 - Retail	$19.95	$5.58
i.Sound Harmony White Speaker for iPod Model DGUN-946 - Retail	$79.95	$9.62
CIRCUS PONIES NoteBook v2.1 - Small Box - Retail	$44.95	$0.00
Microsoft Word Mac 2008 - Retail	$198.95	$0.00
Patriot Memory 2GB DDR2 667 (PC2 5300) Mac Memory for Apple Notebook - OEM	$45.99	$5.58
GRIFFIN Karaoke for iPod Model 9757-IKAROKE-2 - Retail	$19.95	$5.58
Kensington QuickSeek FM Transmitter for iPod Model K33384US - Retail	$39.95	$0.00
mushkin 4GB (2 x 2GB) DDR2 800 (PC2 6400) ECC Fully Buffered Memory For Apple  XSERVE - Retail	$219.99	$5.58
Transcend 2GB DDR2 667 (PC2 5300) ECC Fully Buffered Memory for Apple Mac Pro - Retail	$76.99	$5.58
Adobe Creative Suite 3 Web Premium Mac Upgrade - Retail	$485.95	$0.00
Punch! Software Home Design Studio - Retail	$125.95	$0.00
DLO Care Kit for iPod Model 007-0760 - Retail	$19.95	$5.58
OtterBox Case for iPod Video Model 908-01.3 - Retail	$39.99	$5.58
MARWARE Sport Grip Backwinder case for iPod Video 30GB Model 602956002833 - Retail	$6.95	$5.58
e frontier Manga Studio Debut 3.0 Mac - Retail	$41.95	$0.00
iRam 8GB (2 x 4GB) DDR2 800 (PC2 6400) ECC Fully Buffered Dual Channel Kit Memory For Apple - Retail	$849.99	$0.00
pacific DESIGN Arctic White iPod mini Flip Case Model PD0292 - Retail	$14.95	$5.58
iMainGo Green Portable Speaker System and Case For iPod Model 06GWB01 - Retail	$39.99	$5.58
SANS DIGITAL 1.5TB 7200 RPM 3.5&quot; USB 2.0 / IEEE 1394b External Hard Drive Model MS2UB15 - Retail	$1,185.99	$0.00
iHome Alarm Clock for iPod Model iH4P - Retail	$49.95	$0.00
Ten navipod Wireless Remote Control for 3rd/4th Generation iPod &amp; mini Model TIA.03022 - Retail	$27.98	$5.58
I-O DATA PRIE Black TuneWallet for all iPods Model PRIE-PDWLTLE-BLK - Retail	$39.99	$5.58
APPLE iWork '08 Family Pack - Retail	$94.00	$0.00
mophie Mueva Wraptor Nano - Frost (2nd Gen) Model MUE-WPT-N2-FST - Retail	$24.99	$5.58
BookEndz Docking Station for 17&quot; MacBook Pro Model BE-MBP17 - Retail	$314.99	$8.54
BELKIN Blue Silicone Sleeve for iPod classic 80GB Model F8Z210-BLU - Retail	$19.99	$5.58
Tekkeon myPower Mobile FM Tansmitter For iPod Model MP1100-50 - Retail	$24.95	$0.00
I-O DATA Earphone Winder - Jewel Heart Model JWL-CLIP-HRT - Retail	$39.99	$5.58
i.Sound Jeli Sleeve Twin Pack for iPod shuffle Model DGIPOD-976 - Retail	$5.59	$0.00
DLO Action Jacket  for 3rd Generation iPod nano - black/pink Model 008-1227 - Retail	$25.95	$6.58
GRIFFIN Black USB to Dock Cable Model 3013-IDCKCBL - Retail	$16.95	$5.58
BELKIN Black Leather Folio Case for iPod nano 3G Model F8Z206-KR - Retail	$29.95	$5.58
GRIFFIN Wireless Sound System for iPod Model Evolve - Retail	$299.99	$11.26
acomdata 320GB 7200 RPM 3.5&quot; USB 2.0 External Hard Drive Model HD320UHE5-72 - Retail	$119.99	$0.00
BELKIN Black iPod Video Canvas Holster Model F8Z118-BLK - Retail	$19.95	$5.58
Speck SeeThru Hard Shell for 13&quot; MacBook Model MB13-AQU-SEE - Retail	$34.99	$5.58
iRam 512MB PC133 Memory For Apple Notebook - Retail	$64.99	$0.00
SimCity 4 Deluxe Editon Game ASPYR - Retail	$52.95	$5.58
iHome Portable Speaker Case for iPod &amp; Shuffle Model iH19P - Retail	$64.95	$6.58
SoNNeT USB Power Adapter For iPod Model IPOD-AC-CHG-W - Retail	$14.95	$6.58
iLuv Video dock for your iPod Model i185 - Retail	$119.99	$5.58
DLO Music Display Remote + Charging Dock for iPod Model 006-1000 - Retail	$119.95	$5.58
BookEndz Docking Station for 13&quot; MacBook - Black Model BE-MB13B - Retail	$144.99	$7.15
iHome Portable Water-Resistant Stereo Sport Case for iPod, shuffle (Black) Model ih19B - Retail	$64.95	$7.15
SoNNeT Battery For 3rd Generation iPods Model BAT_3G - Retail	$24.99	$5.58
V-MODA Vibe Noise-Isolating In-Ear Earphones Model VM-V-GUNBLACK - Retail	$89.95	$5.58
Adobe Production Premium CS3 For Mac - Retail	$1,679.95	$0.00
SimpleTech SimpleDrive 1TB 7200 RPM 3.5&quot; USB 2.0 / IEEE 1394a External Hard Drive (designed by Pininfarina) Model SP-UF35/1TB - Retail	$282.99	$0.00
Rosewill Pink Silicone Case For iPod nano 2nd Model RSC-005 - Retail	$4.99	$0.00
GEAR HEAD Bluetooth Laser Mouse Model BT9100RU - Retail	$44.99	$5.58
GRIFFIN Black Leather Case for 3rd Gen iPod nano Model 8143-NELNCVB - Retail	$19.95	$0.00
Speck MacBook 13&quot; See Thru - CLEAR Model MB13-CLR-SEE - Retail	$34.99	$6.58
JENSEN Universal Docking Digital Music System w/CD For iPod Model JiMS-210-BK - Retail	$59.95	$8.10
APPLE Final Cut Express HD 3.5 - Retail	$278.00	$0.00
F / A - 18 Operation Iraqi Freedom Mac Games Graphic Simulations Corp. - Retail	$35.99	$5.58
Blue's Clues: Blue Takes You To School Games MacSoft - Retail	$16.95	$5.58
GRIFFIN Polycarbonate case for iPod nano 2G Model 8108-NCLEAR2 - Retail	$16.95	$5.58
VOX 750GB 7200 RPM 3.5&quot; USB 2.0 / eSATA External Hard Drive Model EXSA-35C-750G5K - Retail	$235.99	$0.00
Speck TechStyle Puck Case for Shuffle 2nd Gen Model SHF2-CC - Retail	$16.95	$5.58
Speck Canvas Sport case for the new 2nd gen iPod nano Model NN2-BLU-CV - Retail	$19.95	$5.58
CTA Digital Black Skin Case with Armband For iPod nano 2Gen Model IP-H2NBL - Retail	$14.99	$6.58
